EDU_0669,0.697841726618705,"Programming best practices: clean code, version control, and collaborative development",0.07692307692307693,0.0,0.0022577495728581887,0.0016289961311341885,0.0012443438914027148,1.0,0.16901408450704225,0.36822125813449025,0.30894322540416486,0.020541549953314663,0.0
EDU_0670,0.9280575539568344,"Software development lifecycle: planning, coding, testing, and maintaining quality code",0.3076923076923077,0.007389556362733228,0.011715889675372224,0.010588474852372225,0.009276018099547511,0.0,0.08450704225352113,0.4396691973969632,0.32105494285060043,0.380952380952381,0.6
EDU_0671,0.7745803357314148,"Python web development: building dynamic websites with Django, Flask, and modern Python frameworks",0.23076923076923078,0.010842569308621278,0.016292409079814496,0.016595398085929546,0.011312217194570137,1.0,0.0,0.20878524945770072,0.44587713340227975,0.22408963585434177,0.3
EDU_0672,0.20623501199040767,"Cloud architecture design: scalability, reliability, and cost optimization strategies",0.15384615384615385,0.039446928068051286,0.05660646001139045,0.05996742007737731,0.05995475113122172,0.0,0.16901408450704225,0.2967733188720175,0.29669148500165754,0.3594771241830066,0.7
EDU_0673,0.6666666666666666,Full-stack JavaScript development: using Node.js with React for complete web applications,0.23076923076923078,0.0,0.0016272068993572533,0.0012217470983506412,0.0006787330316742081,0.5,0.7887323943661972,0.17584056399132325,0.34487086065042316,0.041083099906629325,0.2
EDU_0674,0.21103117505995203,"Programming best practices: clean code, version control, and collaborative development",0.0,0.014999534320573719,0.016902611667073467,0.01649358582773366,0.016289592760180997,0.0,0.676056338028169,0.36822125813449025,0.30894322540416486,0.1372549019607843,0.03
EDU_0675,0.6043165467625898,"Mobile app development: React Native, Flutter, and cross-platform development strategies",0.0,0.0034731923876936454,0.007627532340737125,0.003461616778660151,0.003506787330316742,0.5,0.4225352112676056,0.30775488069414325,0.333029801803721,0.5443510737628385,0.5
EDU_0676,0.4100719424460431,"Django deployment: configuring production environments, database optimization, and scaling applications",0.3076923076923077,0.0031611871720840703,0.006142706045073631,0.004276114844227245,0.002828054298642534,0.5,0.9084507042253521,0.22708785249457697,0.4980928046450215,0.03081232492997199,0.0
EDU_0677,0.5467625899280575,"JavaScript frameworks and libraries: React, Vue, Angular, and choosing the right tool for your project",0.3076923076923077,0.012762720809661298,0.020889268570498738,0.0177153329260843,0.015497737556561086,0.0,0.7605633802816901,0.22342733188720176,0.4878534617872221,0.07189542483660132,0.6
EDU_0678,0.7002398081534772,"PostgreSQL with Python: database integration, ORM usage, and building data-driven applications",0.0,0.14730759678370742,0.2733910991782605,0.342598248829159,0.33223981900452493,0.0,0.7042253521126761,0.3297180043383948,0.4021693413559717,0.07189542483660132,0.3
EDU_0679,0.4100719424460431,"Django REST framework: creating APIs, serializers, authentication, and API documentation",0.3076923076923077,0.0,0.001891628020502807,0.0014253716147424149,0.0011312217194570137,0.5,0.6619718309859155,0.03660520607375273,0.333029801803721,0.03081232492997199,0.0
EDU_0680,0.46522781774580335,"Flask extensions: SQLAlchemy, Flask-Login, and other essential Flask packages for web development",0.07692307692307693,0.009398963087144142,0.01604832804491091,0.010283038077784565,0.00995475113122172,1.0,0.33098591549295775,0.20512472885032546,0.4351180182345402,0.14565826330532214,0.3
EDU_0681,0.8968824940047961,"Software development lifecycle: planning, coding, testing, and maintaining quality code",0.3076923076923077,0.03906041414423644,0.03707997721910341,0.027387497454693547,0.020022624434389142,0.0,0.08450704225352113,0.4396691973969632,0.32105494285060043,0.07189542483660132,0.3
EDU_0682,0.697841726618705,"Code quality and testing: unit testing, integration testing, and continuous integration",0.15384615384615385,0.015603365309987273,0.01547880563013587,0.009977601303196904,0.007805429864253394,0.0,0.7464788732394366,0.032944685466377466,0.32105494285060043,0.020541549953314663,0.0
EDU_0683,0.697841726618705,"Flask extensions: SQLAlchemy, Flask-Login, and other essential Flask packages for web development",0.3076923076923077,0.006259507621619943,0.0070376698397201206,0.005090612909794339,0.004411764705882354,0.0,0.3873239436619718,0.20512472885032546,0.4351180182345402,0.020541549953314663,0.0
EDU_0684,0.8225419664268585,"SQL for data analysis: complex queries, window functions, and analytical functions for business intelligence",0.23076923076923078,0.0734353171276893,0.09242535188349198,0.0794135613927917,0.07058823529411765,0.5,0.7253521126760564,0.3809652928416486,0.5478561127313686,0.0,0.3
EDU_0685,0.9976019184652277,"Modern web development practices: responsive design, performance optimization, and deployment strategies",0.15384615384615385,0.0032923535438204345,0.010068342689773004,0.007839543881083282,0.007579185520361992,0.0,0.9859154929577465,0.4341106290672453,0.5082341618579367,0.5032679738562092,0.5
EDU_0686,0.7937649880095923,React Native mobile development: cross-platform app development with React Native and Expo,0.0,0.0014164415882772967,0.007159710357171914,0.00946854001221747,0.009502262443438915,0.0,0.15492957746478875,0.3150759219088938,0.3565810763904089,0.020541549953314663,0.2
EDU_0687,0.5467625899280575,"Advanced JavaScript concepts: closures, prototypes, promises, and functional programming patterns",0.3076923076923077,0.027066840520319147,0.04190057765844927,0.03828140908165343,0.03461538461538462,0.0,0.08450704225352113,0.20512472885032546,0.4351180182345402,0.07189542483660132,0.6
EDU_0688,0.961630695443645,"Full-stack web development bootcamp: HTML, CSS, JavaScript, React, Node.js, and database integration",0.6923076923076923,0.033899909968644254,0.021397770726547877,0.007126858073712075,0.003733031674208145,0.5,0.08450704225352113,0.3516811279826465,0.46707311478370617,0.1372549019607843,0.2
EDU_0689,0.7002398081534772,"PostgreSQL with Python: database integration, ORM usage, and building data-driven applications",0.07692307692307693,0.015522647542764896,0.031506793588804816,0.03960496843819996,0.03914027149321267,0.0,0.6690140845070423,0.3297180043383948,0.4021693413559717,0.07189542483660132,0.3
EDU_0690,0.4796163069544364,"Building interactive user interfaces: state management, component design, and user experience best practices",0.3076923076923077,0.026295364937443732,0.025730209096086566,0.012217470983506413,0.008484162895927603,0.0,0.9225352112676056,0.3131778741865511,0.5478561127313686,0.523809523809524,0.6
EDU_0691,0.24460431654676257,"Data science career guide: essential skills, tools, and projects for becoming a successful data scientist in 2024",0.6923076923076923,0.003941200211108006,0.005410462940362867,0.0021380574221136228,0.0014705882352941176,1.0,0.3380281690140845,0.7382049891540132,0.5953871165388671,0.44164332399626527,0.4
EDU_0692,0.08872901678657073,"Backend security: authentication, authorization, data validation, and protecting against common vulnerabilities",0.07692307692307693,0.11253919468504547,0.08392319583435033,0.05884748523722256,0.047058823529411764,1.0,0.823943661971831,0.2563720173535792,0.576629746489151,0.18207282913165265,0.2
EDU_0693,0.6666666666666666,"Advanced Node.js concepts: streams, clusters, performance optimization, and production deployment",0.15384615384615385,0.005128682748129522,0.00750549182328533,0.004479739360619019,0.003393665158371041,0.5,0.3380281690140845,0.0695498915401302,0.4351180182345402,0.041083099906629325,0.2
EDU_0694,0.697841726618705,"Algorithm and data structures: arrays, linked lists, trees, graphs, and sorting algorithms",0.23076923076923078,0.0178727763807395,0.015539825888861767,0.01262472001628996,0.010180995475113122,0.5,0.6267605633802817,0.45065075921908904,0.3565810763904089,0.020541549953314663,0.0
EDU_0695,0.3717026378896882,"Container orchestration: Docker Swarm, Kubernetes, and managing microservices at scale",0.15384615384615385,0.11253919468504547,0.11187047433081115,0.05110975361433516,0.04513574660633484,0.5,0.7605633802816901,0.02928416485900215,0.30894322540416486,0.03081232492997199,0.4
EDU_0696,0.856115107913669,"SQL for data analysis: complex queries, window functions, and analytical functions for business intelligence",0.15384615384615385,0.01598056564527646,0.02276055650475958,0.01964976583180615,0.01968325791855204,0.0,0.5915492957746479,0.3809652928416486,0.5478561127313686,0.18487394957983194,0.3
EDU_0697,0.12709832134292565,"Algorithm and data structures: arrays, linked lists, trees, graphs, and sorting algorithms",0.6923076923076923,0.036074632889385616,0.01993328451712635,0.005497861942577886,0.00497737556561086,0.5,0.6338028169014085,0.45065075921908904,0.3565810763904089,0.0,0.3
EDU_0698,0.15107913669064746,"Career transition to tech: portfolio building, networking, and landing your first developer job",0.3076923076923077,0.02041849057775294,0.019058660808721827,0.009977601303196904,0.0082579185520362,1.0,0.3380281690140845,0.06222885032537967,0.4132664452816375,0.1372549019607843,0.2
EDU_0699,0.6282973621103117,"Mobile app deployment: app store optimization, testing, and release management",0.07692307692307693,0.05175095464282388,0.0630949475225775,0.04744451231928324,0.041628959276018104,0.5,0.6830985915492958,0.0,0.2067181328037675,0.6993464052287582,0.4
EDU_0700,0.3405275779376499,Deep dive into machine learning algorithms: supervised and unsupervised learning techniques with practical Python implementations,0.6923076923076923,0.004735959765297569,0.0041697176796029614,0.00030543677458766036,0.00011312217194570136,0.5,0.8450704225352113,0.45783622559652937,0.7345722494759324,0.11484593837535015,0.4
EDU_0701,0.8968824940047961,"Programming fundamentals: variables, functions, control structures, and problem-solving techniques",0.07692307692307693,0.007535469249635217,0.00951916036123993,0.006617796782732641,0.005203619909502263,0.5,0.7535211267605634,0.20878524945770072,0.44587713340227975,0.07189542483660132,0.3
EDU_0702,0.6858513189448441,Full-stack JavaScript development: using Node.js with React for complete web applications,0.07692307692307693,0.0,0.004088357334635099,0.004174302586031358,0.0030542986425339366,0.0,0.676056338028169,0.17584056399132325,0.34487086065042316,0.5443510737628385,0.4
EDU_0703,0.21103117505995203,"Algorithm and data structures: arrays, linked lists, trees, graphs, and sorting algorithms",0.15384615384615385,0.08839216416752041,0.09118460662273208,0.08002443494196701,0.05554298642533937,0.0,0.5915492957746479,0.45065075921908904,0.3565810763904089,0.1372549019607843,0.03
EDU_0704,0.8201438848920862,"Advanced React patterns: context API, custom hooks, performance optimization, and testing strategies",0.07692307692307693,0.034925956971221014,0.06840371003173053,0.06271635104866626,0.06278280542986425,0.0,0.11971830985915494,0.08053145336225603,0.46707311478370617,0.14565826330532214,0.5
EDU_0705,0.47242206235011985,"Frontend performance optimization: code splitting, lazy loading, and bundle optimization techniques",0.3076923076923077,0.0,0.0010576844845822146,0.0006108735491753207,0.00045248868778280545,0.5,0.0,0.07687093275488077,0.4565281149296547,0.19327731092436976,0.2
EDU_0706,0.6402877697841726,"MongoDB administration: indexing, aggregation pipelines, and performance monitoring",0.15384615384615385,0.0021731706559870853,0.0029086323326010903,0.0026471187130930563,0.002149321266968326,1.0,0.08450704225352113,0.01830260303687642,0.2717547170270258,0.44164332399626527,0.0
EDU_0707,0.7961630695443644,"Advanced React patterns: context API, custom hooks, performance optimization, and testing strategies",0.07692307692307693,0.21399521902455682,0.31323732812627125,0.2535125229077581,0.2503393665158371,0.5,0.4225352112676056,0.08053145336225603,0.46707311478370617,0.4005602240896359,0.4
EDU_0708,0.9832134292565946,"Full-stack web development bootcamp: HTML, CSS, JavaScript, React, Node.js, and database integration",0.15384615384615385,0.034925956971221014,0.03917500610202587,0.031663612298920785,0.024321266968325792,0.5,0.45774647887323944,0.3516811279826465,0.46707311478370617,0.42110177404295057,0.2
EDU_0709,0.08872901678657073,"Building RESTful APIs: Node.js, Express, database integration, and API design best practices",0.3076923076923077,0.034680699140045325,0.02473354487023025,0.01863164324984728,0.016402714932126698,0.0,0.6619718309859155,0.39018438177874193,0.3796203259682276,0.18207282913165265,0.2
EDU_0710,0.5995203836930455,"Advanced machine learning concepts: ensemble methods, neural networks, and hyperparameter optimization strategies",0.15384615384615385,0.05677020272577691,0.08561142299243349,0.07259214009366727,0.07262443438914028,0.0,0.09154929577464789,0.19590563991323223,0.5953871165388671,0.7637721755368814,0.43
EDU_0711,0.697841726618705,"Flask extensions: SQLAlchemy, Flask-Login, and other essential Flask packages for web development",0.15384615384615385,0.05449070193412188,0.07584818159628996,0.054265933618407654,0.041628959276018104,0.0,0.676056338028169,0.20512472885032546,0.4351180182345402,0.020541549953314663,0.0
EDU_0712,0.7002398081534772,"PostgreSQL optimization: indexing strategies, query planning, and database performance monitoring",0.38461538461538464,0.020169352084691564,0.026482792287039293,0.01486458969659947,0.012556561085972851,0.5,0.5070422535211268,0.20512472885032546,0.4351180182345402,0.07189542483660132,0.3
EDU_0713,0.1342925659472422,"Software development lifecycle: planning, coding, testing, and maintaining quality code",0.07692307692307693,0.003442923224985253,0.008075014238060368,0.005803298717165547,0.005542986425339367,0.0,0.2535211267605634,0.4396691973969632,0.32105494285060043,0.3594771241830066,0.32999999999999996
EDU_0714,0.4748201438848921,"Frontend development mastery: HTML5, CSS3, JavaScript ES6+, React, and modern frontend frameworks",0.23076923076923078,0.08304305982428363,0.0534944268163697,0.026776623905518226,0.021380090497737557,1.0,0.08450704225352113,0.20512472885032546,0.4351180182345402,0.8281979458450046,0.4
EDU_0715,0.7002398081534772,"PostgreSQL advanced course: advanced SQL features, performance tuning, and database administration",0.3076923076923077,0.0,0.003945976730941339,0.003461616778660151,0.0030542986425339366,1.0,0.8450704225352113,0.4121475054229936,0.44587713340227975,0.07189542483660132,0.3
EDU_0716,0.7625899280575539,"Python web development: building dynamic websites with Django, Flask, and modern Python frameworks",0.23076923076923078,0.017698922728260534,0.03148645350256285,0.03481979230299328,0.030203619909502263,0.0,0.14788732394366197,0.20878524945770072,0.44587713340227975,0.03081232492997199,0.3
EDU_0717,0.7625899280575539,"Python automation and scripting: automating tasks, file processing, and API integrations",0.07692307692307693,0.10505262177516997,0.1528964282808559,0.11301160659743432,0.11300904977375566,1.0,0.676056338028169,0.03660520607375273,0.333029801803721,0.03081232492997199,0.3
EDU_0718,0.7625899280575539,"Advanced Python programming: decorators, generators, async programming, and performance optimization",0.15384615384615385,0.0,0.004474818973232446,0.004886988393402566,0.00497737556561086,0.0,0.2535211267605634,0.3516811279826465,0.46707311478370617,0.03081232492997199,0.3
EDU_0719,0.3717026378896882,"Container orchestration: Docker Swarm, Kubernetes, and managing microservices at scale",0.0,0.05646751109869299,0.05032137336262306,0.0438810832824272,0.041628959276018104,0.0,0.9225352112676056,0.02928416485900215,0.30894322540416486,0.03081232492997199,0.4
EDU_0720,0.8441247002398081,SQL project tutorial: designing and implementing a complete database system from scratch,0.15384615384615385,0.10496026202229052,0.1536083312993247,0.15027489309712888,0.14638009049773756,0.0,0.2535211267605634,0.8297180043383949,0.333029801803721,0.3594771241830066,0.3
EDU_0721,0.2685851318944844,Data structure implementation: building custom data structures and understanding trade-offs,0.23076923076923078,0.040246344416503675,0.040354731104059884,0.032376298106291994,0.026809954751131224,0.0,0.9084507042253521,0.3187364425162691,0.3681633090686507,0.1372549019607843,0.0
EDU_0722,0.5299760191846522,"Object-oriented programming: classes, inheritance, polymorphism, and design patterns",0.15384615384615385,0.034925956971221014,0.03091693108778781,0.019446141315414375,0.017081447963800907,0.0,0.647887323943662,0.2931127982646422,0.28429644614156135,0.12605042016806725,0.6
EDU_0723,0.2805755395683453,"Data structures mastery: arrays, stacks, queues, linked lists, trees, and hash tables",0.3076923076923077,0.08895253174381422,0.07241070702139776,0.03879047037263286,0.02986425339366516,0.0,0.7323943661971831,0.1611984815618222,0.29669148500165754,0.42110177404295057,0.4
EDU_0724,0.9424460431654675,"System design patterns: caching, message queues, and event-driven architecture",0.07692307692307693,0.057889385613610254,0.06580017899275893,0.040623091020158826,0.027149321266968326,0.5,0.8450704225352113,0.2711496746203905,0.2067181328037675,0.11484593837535015,0.2
EDU_0725,0.4940047961630695,"Interview success strategies: preparation techniques, mock interviews, and confidence building",0.0,0.03302443264723231,0.04604995525181027,0.05518224394217063,0.05520361990950227,0.0,0.4225352112676056,0.05856832971800435,0.4021693413559717,0.20448179271708683,0.2
EDU_0726,0.009592326139088728,"Algorithm optimization: time and space complexity, profiling, and performance improvement",0.23076923076923078,0.0011347055353761138,0.003315434057440403,0.002341681938505396,0.0018099547511312218,0.0,0.08450704225352113,0.17584056399132325,0.34487086065042316,0.6059757236227825,0.2
EDU_0727,0.7074340527577937,PostgreSQL vs MySQL: choosing the right relational database for your application needs,0.15384615384615385,0.005819440563782558,0.014075339679440241,0.014355528405620035,0.01323529411764706,0.0,0.676056338028169,0.1648590021691974,0.30894322540416486,0.5032679738562092,0.32999999999999996
EDU_0728,0.05995203836930455,"AI career roadmap: essential skills, certifications, and projects for becoming an AI engineer",0.07692307692307693,0.0036835242618981096,0.007546171995769261,0.003461616778660151,0.002828054298642534,0.5,0.9154929577464789,0.39384490238611725,0.39095480557894735,0.22689075630252103,0.4
EDU_0729,0.9712230215827338,Web development project tutorial: building a complete e-commerce website from scratch,0.23076923076923078,0.0,0.0005898625010170044,0.0004072490327835472,0.00033936651583710406,1.0,0.5915492957746479,0.6831616052060738,0.29669148500165754,0.6349206349206349,0.6
EDU_0730,0.3717026378896882,"DevOps culture and practices: collaboration, automation, and continuous improvement methodologies",0.15384615384615385,0.06527971810872062,0.06881051175656984,0.028303807778456525,0.02386877828054299,1.0,0.08450704225352113,0.13733731019522782,0.4351180182345402,0.03081232492997199,0.4
EDU_0731,0.7601918465227817,"Algorithm and data structures: arrays, linked lists, trees, graphs, and sorting algorithms",0.15384615384615385,0.036747539660364474,0.027276055650475955,0.01323559356546528,0.011425339366515838,0.0,0.16901408450704225,0.45065075921908904,0.3565810763904089,0.7852474323062557,0.43
EDU_0732,0.031175059952038366,"Business analytics with Python: data visualization, statistical analysis, and creating actionable insights from data",0.15384615384615385,0.011246158144733166,0.01739077373688064,0.009264915495825697,0.006108597285067874,0.0,0.4225352112676056,0.5458242950108461,0.6229149951967026,0.06162464985994398,0.3
EDU_0733,0.46282973621103113,Flask vs Django: choosing the right Python web framework for your project needs,0.07692307692307693,0.024161777032690696,0.03602229273452119,0.03278354713907554,0.032805429864253395,0.5,0.4225352112676056,0.13923535791757052,0.22004867009874207,0.18487394957983194,0.2
EDU_0734,0.031175059952038366,"Advanced analytics techniques: predictive modeling, time series analysis, and business intelligence dashboards",0.07692307692307693,0.010841017043867002,0.01852981856643072,0.013642842598248828,0.012669683257918552,0.0,0.7605633802816901,0.25271149674620397,0.5671250752320001,0.06162464985994398,0.3
EDU_0735,0.05995203836930455,"Introduction to artificial intelligence: machine learning, deep learning, and neural network architectures",0.23076923076923078,0.02025239824904536,0.011370108209258807,0.006719609040928528,0.004864253393665159,1.0,0.4225352112676056,0.4414316702819958,0.5282302973806621,0.22689075630252103,0.4
EDU_0736,0.8968824940047961,"Programming fundamentals: variables, functions, control structures, and problem-solving techniques",0.15384615384615385,0.0004858588680885416,0.0023187698315840855,0.0019344329057218487,0.001583710407239819,0.0,0.676056338028169,0.20878524945770072,0.44587713340227975,0.07189542483660132,0.3
EDU_0737,0.6282973621103117,"Mobile development career: skills, tools, and opportunities in the mobile app industry",0.07692307692307693,0.12432166030238118,0.1415263200715971,0.07727550397067806,0.057466063348416294,0.0,0.9225352112676056,0.1648590021691974,0.30894322540416486,0.6993464052287582,0.4
EDU_0738,0.2589928057553957,"Data science project walkthrough: cleaning messy datasets, feature engineering, and building predictive models with real-world business applications",0.15384615384615385,0.025400484306603334,0.04157513627857782,0.04408470779881898,0.04196832579185521,0.0,0.014084507042253521,0.8663232104121477,0.8791365878339663,0.38001867413632123,0.4
EDU_0739,0.697841726618705,Competitive programming: problem-solving strategies and advanced algorithmic techniques,0.38461538461538464,6.441898730247426e-05,0.0022780896591001543,0.0007126858073712076,0.00045248868778280545,0.5,0.014084507042253521,0.30409436008676793,0.32105494285060043,0.020541549953314663,0.0
EDU_0740,0.8633093525179856,"Database fundamentals: normalization, indexing, transactions, and performance tuning strategies",0.38461538461538464,0.04575067523516811,0.05920999105036205,0.036448788434127466,0.028054298642533938,0.5,0.3380281690140845,0.19780368763557488,0.4132664452816375,0.46218487394957986,0.32999999999999996
EDU_0741,0.3237410071942446,"Database optimization: indexing, query tuning, and performance monitoring techniques",0.3076923076923077,0.0014195461177858495,0.002786591815149296,0.0008144980655670943,0.0005656108597285067,0.5,0.4014084507042254,0.15753796095444694,0.28429644614156135,0.48272642390289455,0.3
EDU_0742,0.17745803357314147,"Cloud architecture design: scalability, reliability, and cost optimization strategies",0.3076923076923077,0.006774083387662599,0.005125701732975348,0.0027489309712889435,0.0019230769230769232,0.5,0.1619718309859155,0.2967733188720175,0.29669148500165754,0.1372549019607843,0.4
EDU_0743,0.7625899280575539,"Python web development: building dynamic websites with Django, Flask, and modern Python frameworks",0.23076923076923078,0.00035003570208934874,0.00488162069807176,0.005905110975361434,0.005542986425339367,0.0,0.852112676056338,0.20878524945770072,0.44587713340227975,0.03081232492997199,0.3
EDU_0744,0.5899280575539568,Deep dive into machine learning algorithms: supervised and unsupervised learning techniques with practical Python implementations,0.15384615384615385,0.0014715469870541118,0.006020665527621837,0.00570148645896966,0.005429864253393666,0.5,0.07042253521126761,0.45783622559652937,0.7345722494759324,0.7852474323062557,0.6
EDU_0745,0.42446043165467623,"Django project structure: models, views, templates, and following Django best practices",0.15384615384615385,0.07724069417279811,0.06728500528842242,0.05019344329057218,0.04524886877828054,0.5,0.9577464788732395,0.2363069414316703,0.32105494285060043,0.18487394957983194,0.3
EDU_0746,0.6666666666666666,Node.js development course: building scalable server-side applications with JavaScript,0.23076923076923078,0.014174505603675763,0.01566186640631356,0.011199348401547545,0.008371040723981902,1.0,0.676056338028169,0.36822125813449025,0.30894322540416486,0.041083099906629325,0.2
EDU_0747,0.7338129496402878,"Object-oriented programming: classes, inheritance, polymorphism, and design patterns",0.3076923076923077,0.0017913135264350693,0.00351883491986006,0.0021380574221136228,0.0016968325791855204,0.0,0.31690140845070425,0.2931127982646422,0.28429644614156135,0.23809523809523808,0.22999999999999998
EDU_0748,0.5707434052757794,"Node.js backend development: building APIs, handling databases, and creating server-side applications",0.0,0.027274067865015055,0.04828736473842649,0.0423538994094889,0.03970588235294118,0.5,0.5070422535211268,0.3553416485900218,0.47751422132445587,0.5648926237161531,0.8
EDU_0749,0.08633093525179855,"Introduction to artificial intelligence: machine learning, deep learning, and neural network architectures",0.0,0.010107571947471361,0.013404116833455373,0.009977601303196904,0.006447963800904978,1.0,0.5070422535211268,0.4414316702819958,0.5282302973806621,0.6676003734827265,0.7
EDU_0750,0.580335731414868,"Real-world machine learning applications: computer vision, natural language processing, and recommendation systems",0.23076923076923078,0.03853031573065102,0.05876250915303881,0.04194665037670535,0.04196832579185521,0.0,0.5915492957746479,0.1995661605206075,0.6046427538995625,0.1484593837535014,0.4
EDU_0751,0.8729016786570742,"Software engineering career: roles, responsibilities, and advancing in the tech industry",0.38461538461538464,0.032589022383657754,0.043283703522902936,0.019446141315414375,0.01572398190045249,0.0,0.16901408450704225,0.30775488069414325,0.333029801803721,0.6993464052287582,0.43
