EDU_0335,0.09112709832134291,"Building RESTful APIs: Node.js, Express, database integration, and API design best practices",0.07692307692307693,0.0,0.002542510780245708,0.0016289961311341885,0.0013574660633484162,0.5,0.676056338028169,0.39018438177874193,0.3796203259682276,0.5854341736694678,0.2
EDU_0336,0.7865707434052758,"Python web development: building dynamic websites with Django, Flask, and modern Python frameworks",0.07692307692307693,0.014068175468007822,0.027174355219266127,0.024842190999796378,0.023076923076923078,0.5,0.6267605633802817,0.20878524945770072,0.44587713340227975,0.6059757236227825,0.53
EDU_0337,0.7793764988009592,"Python web development: building dynamic websites with Django, Flask, and modern Python frameworks",0.15384615384615385,0.0,0.0014848262956634938,0.0016289961311341885,0.0016968325791855204,0.0,0.5,0.20878524945770072,0.44587713340227975,0.5443510737628385,0.5
EDU_0338,0.6666666666666666,"Node.js ecosystem: npm packages, database integration, and real-time applications with Socket.io",0.0,0.041807922759305824,0.06488487511187047,0.05976379556098554,0.05984162895927602,0.0,0.6408450704225352,0.2014642082429502,0.4242485512427301,0.041083099906629325,0.2
EDU_0339,0.8225419664268585,"Database administration: backup, recovery, security, and maintaining database performance",0.07692307692307693,0.05962016081462854,0.10316491741924985,0.11657503563429036,0.1166289592760181,0.0,0.8450704225352113,0.31141540130151846,0.34487086065042316,0.0,0.3
EDU_0340,0.697841726618705,"Object-oriented programming: classes, inheritance, polymorphism, and design patterns",0.0,0.034984166899506376,0.04385322593767797,0.030950926491549582,0.02420814479638009,0.5,0.4225352112676056,0.2931127982646422,0.28429644614156135,0.020541549953314663,0.0
EDU_0341,0.8225419664268585,"SQL mastery course: database design, query optimization, and advanced SQL techniques",0.07692307692307693,0.0038845425475769147,0.011146367260597185,0.012522907758094073,0.012556561085972851,0.0,0.7394366197183099,0.496475054229935,0.28429644614156135,0.0,0.3
EDU_0342,0.5491606714628297,"Node.js backend development: building APIs, handling databases, and creating server-side applications",0.0,0.005730961472788798,0.01875355951509234,0.01903889228263083,0.01900452488687783,0.0,0.5915492957746479,0.3553416485900218,0.47751422132445587,0.5854341736694678,0.8
EDU_0343,0.3357314148681055,Database backup and recovery: disaster recovery planning and data protection strategies,0.07692307692307693,0.04193132780727081,0.053514766902611664,0.04123396456933415,0.03812217194570136,0.0,0.2535211267605634,0.30409436008676793,0.32105494285060043,0.5854341736694678,0.6
EDU_0344,0.17745803357314147,"Cloud migration: moving applications to the cloud, modernization, and optimization techniques",0.23076923076923078,0.0023283971314147344,0.004027337075909202,0.0012217470983506412,0.0011312217194570137,1.0,0.7394366197183099,0.05490780911062909,0.39095480557894735,0.1372549019607843,0.4
EDU_0345,0.6594724220623501,"MongoDB development: NoSQL database design, document modeling, and query optimization",0.15384615384615385,0.011891124150135046,0.012000650882759742,0.010893911626959886,0.009276018099547511,1.0,0.4225352112676056,0.4323481561822128,0.29669148500165754,0.22408963585434177,0.2
EDU_0346,0.4316546762589928,"Django REST framework: creating APIs, serializers, authentication, and API documentation",0.4615384615384616,0.011454161621806215,0.019485802619803105,0.016595398085929546,0.0166289592760181,0.0,0.4225352112676056,0.03660520607375273,0.333029801803721,0.3025210084033614,0.3
EDU_0347,0.05995203836930455,"AI career roadmap: essential skills, certifications, and projects for becoming an AI engineer",0.07692307692307693,0.049660054018813446,0.04637539663168172,0.026776623905518226,0.020361990950226245,0.0,0.5915492957746479,0.39384490238611725,0.39095480557894735,0.22689075630252103,0.4
EDU_0348,0.4940047961630695,Coding interview bootcamp: problem-solving techniques and whiteboard coding strategies,0.3076923076923077,0.0038007202508459842,0.007200390529655845,0.005803298717165547,0.00497737556561086,1.0,0.16901408450704225,0.3004338394793926,0.30894322540416486,0.20448179271708683,0.2
EDU_0349,0.8393285371702637,SQL project tutorial: designing and implementing a complete database system from scratch,0.07692307692307693,0.0007264599050013972,0.006285086648767391,0.004479739360619019,0.004411764705882354,0.5,0.0,0.8297180043383949,0.333029801803721,0.3594771241830066,0.32999999999999996
EDU_0350,0.2398081534772182,"Programming best practices: clean code, version control, and collaborative development",0.23076923076923078,0.020865542826984572,0.023228378488324788,0.01293015679087762,0.008936651583710408,0.0,0.16901408450704225,0.36822125813449025,0.30894322540416486,0.7422969187675069,0.06
EDU_0351,0.4100719424460431,Django web development: building robust web applications with Python's most popular framework,0.07692307692307693,0.2565676321753438,0.28303230005695224,0.25707595194461413,0.2256787330316742,0.5,0.6830985915492958,0.19048264642082435,0.39095480557894735,0.03081232492997199,0.0
EDU_0352,0.3453237410071942,Deep dive into machine learning algorithms: supervised and unsupervised learning techniques with practical Python implementations,0.23076923076923078,0.036975722579243114,0.03158815393377268,0.022093260028507433,0.01809954751131222,0.0,0.2535211267605634,0.45783622559652937,0.7345722494759324,0.44164332399626527,0.7
EDU_0353,0.0,"Algorithm design techniques: divide and conquer, dynamic programming, and greedy algorithms",0.07692307692307693,0.022233864207879296,0.021845252623871124,0.008450417430258603,0.0067873303167420825,1.0,0.9225352112676056,0.5898861171366595,0.3681633090686507,0.6676003734827265,0.4
EDU_0354,0.43884892086330934,"Flask API development: creating RESTful services, handling JSON data, and API documentation",0.15384615384615385,0.04104576076495607,0.0440159466276137,0.0384850335980452,0.02567873303167421,0.0,0.16901408450704225,0.3187364425162691,0.3681633090686507,0.26330532212885155,0.3
EDU_0355,0.1990407673860911,"AWS cloud computing: EC2, S3, Lambda, and serverless architecture implementation guide",0.23076923076923078,0.01841606904473627,0.023716540558131962,0.022093260028507433,0.021832579185520364,0.0,0.823943661971831,0.36822125813449025,0.30894322540416486,0.6563958916900093,0.8
EDU_0356,0.34772182254196643,Machine learning project tutorial: building end-to-end ML pipelines from data preprocessing to model deployment and monitoring,0.15384615384615385,0.010849554500015523,0.02054348710438532,0.01964976583180615,0.01968325791855204,0.0,0.8591549295774648,0.718004338394794,0.7098295596524693,0.591970121381886,0.6
EDU_0357,0.697841726618705,"Algorithm optimization: time and space complexity, profiling, and performance improvement",0.23076923076923078,0.02029198100027941,0.022130013831258642,0.01486458969659947,0.011990950226244345,0.0,0.35211267605633806,0.17584056399132325,0.34487086065042316,0.020541549953314663,0.0
EDU_0358,0.4940047961630695,"Interview success strategies: preparation techniques, mock interviews, and confidence building",0.0,0.0009779267951941888,0.008013993979334472,0.010486662594176337,0.010520361990950227,0.0,0.5070422535211268,0.05856832971800435,0.4021693413559717,0.20448179271708683,0.2
EDU_0359,0.4100719424460431,"Django deployment: configuring production environments, database optimization, and scaling applications",0.07692307692307693,0.02641023252926019,0.01641444959726629,0.009061290979433922,0.008371040723981902,0.5,0.15492957746478875,0.22708785249457697,0.4980928046450215,0.03081232492997199,0.0
EDU_0360,0.29976019184652275,Data structures in practice: choosing the right structure for different problem types,0.15384615384615385,0.3173465586290397,0.3282483117728419,0.2325391977194054,0.17952488687782805,0.0,0.3098591549295775,0.22898590021691978,0.29669148500165754,0.5032679738562092,0.3
EDU_0361,0.6067146282973621,"Mobile development career: skills, tools, and opportunities in the mobile app industry",0.23076923076923078,0.07288891993418398,0.10428362216255796,0.08796579108124618,0.059049773755656114,1.0,0.08450704225352113,0.1648590021691974,0.30894322540416486,0.6993464052287582,0.4
EDU_0362,0.031175059952038366,"Analytics project walkthrough: cleaning data, performing statistical tests, and creating compelling visualizations",0.15384615384615385,0.00040591723324330184,0.0034781547473761287,0.0026471187130930563,0.0022624434389140274,0.5,0.5915492957746479,0.470715835140998,0.6046427538995625,0.06162464985994398,0.3
EDU_0363,0.5371702637889688,"Algorithm and data structures: arrays, linked lists, trees, graphs, and sorting algorithms",0.15384615384615385,0.048590543603116945,0.061528760881946136,0.04489920586438607,0.041176470588235294,1.0,0.16901408450704225,0.45065075921908904,0.3565810763904089,0.26330532212885155,0.6
EDU_0364,0.2422062350119904,"Data science project walkthrough: cleaning messy datasets, feature engineering, and building predictive models with real-world business applications",0.23076923076923078,0.210262798422899,0.2746115043527784,0.26379556098554263,0.25384615384615383,0.0,0.676056338028169,0.8663232104121477,0.8791365878339663,0.10364145658263305,0.4
EDU_0365,0.45083932853717024,Flask web development: building lightweight web applications with Python's flexible framework,0.23076923076923078,0.0007210269783614297,0.0061020258725897,0.005396049684382,0.005429864253393666,0.0,0.3380281690140845,0.19048264642082435,0.39095480557894735,0.523809523809524,0.2
EDU_0366,0.6019184652278177,Native mobile development: iOS with Swift and Android with Kotlin for platform-specific apps,0.15384615384615385,0.005789947533451305,0.008339435359205923,0.004886988393402566,0.0029411764705882353,1.0,0.24647887323943662,0.1868221258134491,0.3796203259682276,0.17086834733893558,0.2
EDU_0367,0.5155875299760192,"Technical interview preparation: algorithms, data structures, and system design concepts",0.0,0.005006829964918817,0.009030998291432755,0.007432294848299735,0.00746606334841629,1.0,0.943661971830986,0.4433297180043385,0.333029801803721,0.5443510737628385,0.5
EDU_0368,0.9424460431654675,"System design fundamentals: scalability, reliability, and performance optimization principles",0.0,0.06625609263916053,0.08563176307867545,0.05019344329057218,0.04072398190045249,0.0,0.7605633802816901,0.19048264642082435,0.39095480557894735,0.11484593837535015,0.2
EDU_0369,0.4100719424460431,Django security: protecting against common vulnerabilities and implementing secure authentication,0.15384615384615385,0.0,0.0009559840533723864,0.0008144980655670943,0.0009049773755656109,1.0,0.5492957746478874,0.0695498915401302,0.4351180182345402,0.03081232492997199,0.0
EDU_0370,0.8968824940047961,"Programming best practices: clean code, version control, and collaborative development",0.15384615384615385,0.012678122380553228,0.019790903913432592,0.013541030340052941,0.010633484162895928,1.0,0.7605633802816901,0.36822125813449025,0.30894322540416486,0.07189542483660132,0.3
EDU_0371,0.4100719424460431,"Django REST framework: creating APIs, serializers, authentication, and API documentation",0.3076923076923077,0.0422091831982863,0.04417866731754943,0.028405620036652413,0.021040723981900454,0.5,0.08450704225352113,0.03660520607375273,0.333029801803721,0.03081232492997199,0.0
EDU_0372,0.4940047961630695,Coding interview bootcamp: problem-solving techniques and whiteboard coding strategies,0.23076923076923078,0.006807457079879544,0.012793914246196404,0.010893911626959886,0.010972850678733033,0.0,0.2535211267605634,0.3004338394793926,0.30894322540416486,0.20448179271708683,0.2
EDU_0373,0.1726618705035971,"Tech industry insights: market trends, in-demand skills, and future career opportunities",0.38461538461538464,0.007858340318524726,0.010210723293466764,0.007941356139279168,0.008031674208144797,0.0,0.2535211267605634,0.03660520607375273,0.333029801803721,0.42110177404295057,0.5
EDU_0374,0.2805755395683453,Memory management: understanding how data structures work at the hardware level,0.23076923076923078,0.00345766974015088,0.007810593116914816,0.005192425167990226,0.0047511312217194575,0.0,0.16901408450704225,0.13923535791757052,0.22004867009874207,0.42110177404295057,0.4
EDU_0375,0.8968824940047961,"Object-oriented programming: classes, inheritance, polymorphism, and design patterns",0.23076923076923078,0.0,0.0013831258644536654,0.0006108735491753207,0.0005656108597285067,0.0,0.471830985915493,0.2931127982646422,0.28429644614156135,0.07189542483660132,0.3
EDU_0376,0.3764988009592326,"DevOps culture and practices: collaboration, automation, and continuous improvement methodologies",0.23076923076923078,0.04935891465648381,0.06734602554714832,0.028914681327631846,0.022171945701357467,0.0,0.08450704225352113,0.13733731019522782,0.4351180182345402,0.2829131652661065,0.7
EDU_0377,0.5467625899280575,"Node.js backend development: building APIs, handling databases, and creating server-side applications",0.15384615384615385,0.0564372419359846,0.06938003417134489,0.055487680716758296,0.05147058823529412,0.5,0.08450704225352113,0.3553416485900218,0.47751422132445587,0.07189542483660132,0.6
EDU_0378,0.7098321342925659,"PostgreSQL optimization: indexing strategies, query planning, and database performance monitoring",0.15384615384615385,0.009886374219986959,0.015539825888861767,0.014762777438403582,0.014479638009049774,0.5,0.2535211267605634,0.20512472885032546,0.4351180182345402,0.46218487394957986,0.7
EDU_0379,0.4676258992805755,Flask project tutorial: building a complete web application from database design to deployment,0.38461538461538464,0.034925956971221014,0.024753884956472214,0.013642842598248828,0.010067873303167421,0.5,0.056338028169014086,0.668655097613883,0.4021693413559717,0.2829131652661065,0.3
EDU_0380,0.09112709832134291,"Backend development with Python: Django, Flask, database management, and deployment strategies",0.23076923076923078,0.0004020365713576111,0.0032950939711984375,0.0021380574221136228,0.0016968325791855204,0.0,0.676056338028169,0.3297180043383948,0.4021693413559717,0.5854341736694678,0.2
EDU_0381,0.21103117505995203,"Algorithm and data structures: arrays, linked lists, trees, graphs, and sorting algorithms",0.07692307692307693,0.0285717611995902,0.03335774143682369,0.02250050906129098,0.01900452488687783,0.5,0.4295774647887324,0.45065075921908904,0.3565810763904089,0.1372549019607843,0.03
EDU_0382,0.697841726618705,"Algorithm optimization: time and space complexity, profiling, and performance improvement",0.15384615384615385,0.009925180838843872,0.015641526320071594,0.01262472001628996,0.012669683257918552,0.0,0.19014084507042253,0.17584056399132325,0.34487086065042316,0.020541549953314663,0.0
EDU_0383,0.12470023980815347,"Backend development fundamentals: APIs, databases, authentication, and server-side programming",0.3076923076923077,0.007602992766446245,0.01069888536327394,0.006617796782732641,0.005316742081447964,0.0,0.20422535211267606,0.4652928416485901,0.4021693413559717,0.6778711484593838,0.4
EDU_0384,0.20383693045563547,"Cloud migration: moving applications to the cloud, modernization, and optimization techniques",0.15384615384615385,0.0497951010524355,0.06950207468879668,0.06689065363469761,0.0583710407239819,0.5,0.4366197183098592,0.05490780911062909,0.39095480557894735,0.42110177404295057,0.7
EDU_0385,0.8609112709832134,"Database fundamentals: normalization, indexing, transactions, and performance tuning strategies",0.3076923076923077,0.015682530812455374,0.019628183223496864,0.01455915292201181,0.011990950226244345,0.5,0.16901408450704225,0.19780368763557488,0.4132664452816375,0.14565826330532214,0.5
EDU_0386,0.4100719424460431,"Django project structure: models, views, templates, and following Django best practices",0.07692307692307693,0.004484492875104777,0.008807257342771133,0.004988800651598452,0.004072398190045249,0.0,0.4225352112676056,0.2363069414316703,0.32105494285060043,0.03081232492997199,0.0
EDU_0387,0.697841726618705,NoSQL vs SQL: understanding when to use MongoDB and how to design effective document databases,0.23076923076923078,0.03074648412033156,0.029737206085753802,0.01201384646711464,0.009502262443438915,0.0,0.5070422535211268,0.5127440347071586,0.4021693413559717,0.020541549953314663,0.0
EDU_0388,0.9592326139088728,"System design fundamentals: scalability, reliability, and performance optimization principles",0.3076923076923077,0.05744233336437863,0.06974615572370027,0.05396049684381999,0.05395927601809955,0.5,0.5915492957746479,0.19048264642082435,0.39095480557894735,0.46218487394957986,0.5
EDU_0389,0.002398081534772182,"Algorithm design techniques: divide and conquer, dynamic programming, and greedy algorithms",0.15384615384615385,0.009691564993325262,0.016434789683508255,0.014151903889228263,0.011877828054298644,1.0,0.6408450704225352,0.5898861171366595,0.3681633090686507,0.5032679738562092,0.2
EDU_0390,0.8009592326139088,"React development course: components, hooks, state management, and building scalable applications",0.07692307692307693,0.002402905839620006,0.006813928891058498,0.007126858073712075,0.007126696832579186,0.5,0.13380281690140847,0.4084869848156183,0.4351180182345402,0.4005602240896359,0.2
EDU_0391,0.9328537170263789,"Software development lifecycle: planning, coding, testing, and maintaining quality code",0.07692307692307693,0.03368880196206265,0.054369050524774226,0.054164121360211766,0.05056561085972851,0.0,0.5915492957746479,0.4396691973969632,0.32105494285060043,0.3025210084033614,0.6
EDU_0392,0.040767386091127095,"Analytics project walkthrough: cleaning data, performing statistical tests, and creating compelling visualizations",0.15384615384615385,0.24902284933718297,0.17051094296639818,0.1416208511504785,0.1416289592760181,0.0,0.5915492957746479,0.470715835140998,0.6046427538995625,0.48272642390289455,0.3
EDU_0393,0.8968824940047961,"Programming best practices: clean code, version control, and collaborative development",0.23076923076923078,0.020146844245754556,0.013688878040842893,0.006617796782732641,0.005203619909502263,0.5,0.3873239436619718,0.36822125813449025,0.30894322540416486,0.07189542483660132,0.3
EDU_0394,0.11270983213429256,"Backend development fundamentals: APIs, databases, authentication, and server-side programming",0.38461538461538464,0.004265623544751793,0.007241070702139777,0.0077377316228873965,0.00656108597285068,0.0,0.29577464788732394,0.4652928416485901,0.4021693413559717,0.7422969187675069,0.6
EDU_0395,0.7410071942446043,"Programming best practices: clean code, version control, and collaborative development",0.0,0.08827263978144112,0.09183548938247497,0.04204846263490124,0.029524886877828057,0.5,0.0,0.36822125813449025,0.30894322540416486,0.6059757236227825,0.63
EDU_0396,0.961630695443645,Frontend and backend development: creating dynamic web applications with modern frameworks and tools,0.23076923076923078,0.034925956971221014,0.024509803921568624,0.016086336794950112,0.010633484162895928,1.0,0.4225352112676056,0.21610629067245124,0.46707311478370617,0.1372549019607843,0.2
EDU_0397,0.7002398081534772,PostgreSQL vs MySQL: choosing the right relational database for your application needs,0.38461538461538464,0.015557573499736115,0.015682206492555525,0.009264915495825697,0.008371040723981902,0.5,0.9014084507042254,0.1648590021691974,0.30894322540416486,0.07189542483660132,0.3
EDU_0398,0.697841726618705,NoSQL vs SQL: understanding when to use MongoDB and how to design effective document databases,0.07692307692307693,0.0537200024836236,0.05518265397445285,0.037874160048869884,0.029524886877828057,1.0,0.11971830985915494,0.5127440347071586,0.4021693413559717,0.020541549953314663,0.0
EDU_0399,0.5467625899280575,"Advanced JavaScript concepts: closures, prototypes, promises, and functional programming patterns",0.3076923076923077,0.057853683524261894,0.05174517939956065,0.03756872327428222,0.037556561085972856,0.5,0.9225352112676056,0.20512472885032546,0.4351180182345402,0.07189542483660132,0.6
EDU_0400,0.5971223021582733,"Real-world machine learning applications: computer vision, natural language processing, and recommendation systems",0.15384615384615385,0.06453463102666791,0.10304287690179806,0.12024027692934229,0.12024886877828055,0.0,0.4225352112676056,0.1995661605206075,0.6046427538995625,0.849673202614379,0.63
EDU_0401,0.5779376498800959,"JavaScript complete guide: ES6+, async programming, DOM manipulation, and modern JavaScript features",0.15384615384615385,0.0279710347396852,0.047372060857538034,0.04968438199959275,0.0497737556561086,0.0,0.9225352112676056,0.41946854663774413,0.46707311478370617,0.46218487394957986,0.8
EDU_0402,0.8321342925659472,"SQL for data analysis: complex queries, window functions, and analytical functions for business intelligence",0.23076923076923078,0.0019589581198969294,0.006773248718574567,0.007432294848299735,0.007239819004524887,0.0,0.0,0.3809652928416486,0.5478561127313686,0.44164332399626527,0.5
EDU_0403,0.3836930455635491,"DevOps culture and practices: collaboration, automation, and continuous improvement methodologies",0.07692307692307693,0.030235012883797457,0.0352493694573265,0.01964976583180615,0.016968325791855206,0.5,0.1056338028169014,0.13733731019522782,0.4351180182345402,0.42110177404295057,0.8
EDU_0404,0.19664268585131894,"Cloud architecture design: scalability, reliability, and cost optimization strategies",0.07692307692307693,0.0353722330880755,0.06222032381417297,0.06648340460191407,0.066289592760181,0.0,0.14084507042253522,0.2967733188720175,0.29669148500165754,0.5032679738562092,1.0
EDU_0405,0.3717026378896882,"Infrastructure as Code: Terraform, Ansible, and managing cloud resources with code",0.07692307692307693,0.007866101642296109,0.012366772435115124,0.006515984524536754,0.005203619909502263,0.0,0.5915492957746479,0.014642082429501102,0.25906278399451654,0.03081232492997199,0.4
EDU_0406,0.05995203836930455,"AI project development: building intelligent systems using Python, TensorFlow, and modern AI frameworks",0.38461538461538464,0.013351029151532086,0.004698559921894069,0.0013235593565465282,0.0009049773755656109,1.0,0.08450704225352113,0.36266268980477223,0.4980928046450215,0.22689075630252103,0.4
EDU_0407,0.8225419664268585,SQL project tutorial: designing and implementing a complete database system from scratch,0.15384615384615385,0.06824454378938871,0.09447970059393052,0.0970270820606801,0.09389140271493213,1.0,0.7605633802816901,0.8297180043383949,0.333029801803721,0.0,0.3
EDU_0408,0.007194244604316546,"Advanced algorithms: graph algorithms, string matching, and computational complexity analysis",0.23076923076923078,0.05641551022942473,0.054694491904645676,0.034514355528405614,0.024434389140271493,1.0,0.4225352112676056,0.4616323210412149,0.39095480557894735,0.3025210084033614,0.0
EDU_0409,0.3597122302158273,Deep dive into machine learning algorithms: supervised and unsupervised learning techniques with practical Python implementations,0.07692307692307693,0.0162452267858806,0.018143356927833372,0.01455915292201181,0.011877828054298644,0.0,0.5070422535211268,0.45783622559652937,0.7345722494759324,0.6563958916900093,0.6
EDU_0410,0.697841726618705,"Algorithm and data structures: arrays, linked lists, trees, graphs, and sorting algorithms",0.3076923076923077,0.010846449970506971,0.01065820519079001,0.007025045815516188,0.0047511312217194575,0.0,0.676056338028169,0.45065075921908904,0.3565810763904089,0.020541549953314663,0.0
EDU_0411,0.17745803357314147,"AWS cloud computing: EC2, S3, Lambda, and serverless architecture implementation guide",1.0000000000000002,0.1965275837446835,0.10788381742738588,0.023620443901445735,0.01730769230769231,0.0,0.4507042253521127,0.36822125813449025,0.30894322540416486,0.1372549019607843,0.4
EDU_0412,0.2014388489208633,"Cloud migration: moving applications to the cloud, modernization, and optimization techniques",0.15384615384615385,0.04233646890813697,0.025486128061182976,0.015780900020362452,0.012669683257918552,0.5,0.4084507042253521,0.05490780911062909,0.39095480557894735,0.44164332399626527,0.4
EDU_0413,0.05995203836930455,"AI project development: building intelligent systems using Python, TensorFlow, and modern AI frameworks",0.15384615384615385,0.02425801744745584,0.021499471157757705,0.01832620647525962,0.015271493212669685,0.5,0.44366197183098594,0.36266268980477223,0.4980928046450215,0.22689075630252103,0.4
EDU_0414,0.697841726618705,"Software project management: agile methodologies, team collaboration, and delivery strategies",0.3076923076923077,0.03916286361801869,0.038422422911073145,0.01262472001628996,0.008823529411764707,0.5,0.16901408450704225,0.3260574837310196,0.39095480557894735,0.020541549953314663,0.0
EDU_0415,0.7002398081534772,PostgreSQL vs MySQL: choosing the right relational database for your application needs,0.15384615384615385,0.06395253174381423,0.09132698722642583,0.08430054978619425,0.08009049773755657,0.5,0.1971830985915493,0.1648590021691974,0.30894322540416486,0.07189542483660132,0.3
EDU_0416,0.08872901678657073,"Backend development fundamentals: APIs, databases, authentication, and server-side programming",0.23076923076923078,0.006513302908944149,0.010353103897160524,0.0076359193646915085,0.006334841628959277,0.5,0.4225352112676056,0.4652928416485901,0.4021693413559717,0.18207282913165265,0.2
EDU_0417,0.6666666666666666,"Advanced Node.js concepts: streams, clusters, performance optimization, and production deployment",0.23076923076923078,0.0142117599577784,0.013892278903262549,0.00600692323355732,0.0046380090497737565,0.5,0.8450704225352113,0.0695498915401302,0.4351180182345402,0.041083099906629325,0.2
