EDU_0943,206,System design interview masterclass: scalability patterns and distributed systems architecture,0.07692307692307693,0.03226459905001397,0.055019933284517125,0.034514355528405614,0.03393665158371041,1,131,0.0,0.2941176470588235,0.0,0.5
EDU_0944,242,Machine learning project tutorial: building end-to-end ML pipelines from data preprocessing to model deployment and monitoring,0.23076923076923078,0.0713490732979417,0.11111789113985843,0.12095296273671349,0.08122171945701358,0,12,1.0,0.607843137254902,0.0,0.5
EDU_0945,255,Native mobile development: iOS with Swift and Android with Kotlin for platform-specific apps,0.3076923076923077,0.041932880072025086,0.03230005695224148,0.017104459376908982,0.016855203619909505,1,131,0.25,0.27450980392156865,1.0,0.5
EDU_0946,177,"Django deployment: configuring production environments, database optimization, and scaling applications",0.15384615384615385,0.0,0.0016272068993572533,0.0015271838729383016,0.0012443438914027148,2,17,0.25,0.38235294117647056,1.0,0.5
EDU_0947,6,"Algorithm optimization: time and space complexity, profiling, and performance improvement",0.15384615384615385,0.06836562044022228,0.11441298511105687,0.0986560781918143,0.0986425339366516,0,48,0.25,0.2450980392156863,1.0,0.5
EDU_0948,37,"Backend security: authentication, authorization, data validation, and protecting against common vulnerabilities",0.07692307692307693,0.01333550650398932,0.02147913107151574,0.0123192832417023,0.010633484162895928,0,59,0.25,0.4607843137254901,0.0,0.5
EDU_0949,343,"SQL for data analysis: complex queries, window functions, and analytical functions for business intelligence",0.4615384615384616,0.02510167334140511,0.024326743145390933,0.018224394217063736,0.015837104072398193,0,72,0.5,0.43137254901960786,0.0,0.5
EDU_0950,64,"Tech career advancement: skill development, leadership, and navigating career growth opportunities",0.0,0.00404597808202167,0.011105687088113254,0.01170840969252698,0.010180995475113122,2,41,0.25,0.33333333333333337,1.0,1.0
EDU_0951,225,"Object-oriented programming: classes, inheritance, polymorphism, and design patterns",0.3076923076923077,0.0039761261680792285,0.006549507769912945,0.006210547749949094,0.005542986425339367,1,74,0.25,0.196078431372549,1.0,0.5
EDU_0952,337,React Native mobile development: cross-platform app development with React Native and Expo,0.15384615384615385,0.030738722796560182,0.047595801806199656,0.0423538994094889,0.041176470588235294,0,48,0.25,0.2549019607843137,1.0,0.5
EDU_0953,111,Comprehensive data science tutorial: from data collection and preprocessing to advanced analytics and visualization using Python libraries,0.4615384615384616,0.04932321256713545,0.048653486290781874,0.04113215231113826,0.037556561085972856,0,60,0.5,0.7254901960784315,1.0,1.0
EDU_0954,261,"Mobile app development: React Native, Flutter, and cross-platform development strategies",0.15384615384615385,0.01039551705938965,0.019526482792287036,0.019853390348197924,0.01843891402714932,2,120,0.25,0.23529411764705888,1.0,1.0
EDU_0955,48,"Backend security: authentication, authorization, data validation, and protecting against common vulnerabilities",0.15384615384615385,0.008112911738226071,0.010129362948498902,0.00600692323355732,0.0046380090497737565,1,40,0.25,0.4607843137254901,1.0,1.0
EDU_0956,312,"Programming best practices: clean code, version control, and collaborative development",0.0,0.06444071900903418,0.11502318769831583,0.13775198533903482,0.13778280542986426,0,84,0.5,0.21568627450980393,1.0,1.0
EDU_0957,368,"Software engineering career: roles, responsibilities, and advancing in the tech industry",0.07692307692307693,0.0013504703362205456,0.008156374583028233,0.009366727754021583,0.009389140271493214,0,60,0.0,0.23529411764705888,1.0,0.5
EDU_0958,291,"Software project management: agile methodologies, team collaboration, and delivery strategies",0.07692307692307693,0.006771754990531185,0.011878610365307948,0.007839543881083282,0.005995475113122172,0,100,0.25,0.28431372549019607,0.0,0.0
EDU_0959,63,"Tech career advancement: skill development, leadership, and navigating career growth opportunities",0.4615384615384616,0.013427090124491635,0.02040110650069156,0.01547546324577479,0.013461538461538462,1,101,0.25,0.33333333333333337,0.0,0.5
EDU_0960,284,Full-stack JavaScript development: using Node.js with React for complete web applications,0.07692307692307693,0.04502499146254385,0.03638841428687658,0.02728568519649766,0.017873303167420817,2,0,0.25,0.2450980392156863,1.0,1.0
EDU_0961,242,"Machine learning for beginners: understanding algorithms, choosing the right model, and avoiding common pitfalls",0.38461538461538464,0.002121169786718823,0.0075868521682531925,0.006210547749949094,0.005429864253393666,1,133,0.5,0.47058823529411775,0.0,0.5
EDU_0962,242,Machine learning project tutorial: building end-to-end ML pipelines from data preprocessing to model deployment and monitoring,0.15384615384615385,0.0753104529508553,0.10554470750955984,0.057727550397067805,0.057805429864253396,2,92,1.0,0.607843137254902,0.0,0.5
EDU_0963,202,"Building interactive user interfaces: state management, component design, and user experience best practices",0.15384615384615385,0.002301232498214896,0.00351883491986006,0.00285074322948483,0.0027149321266968325,1,131,0.0,0.43137254901960786,1.0,0.5
EDU_0964,291,Competitive programming: problem-solving strategies and advanced algorithmic techniques,0.15384615384615385,0.02397472912980038,0.02011634529330404,0.006515984524536754,0.005429864253393666,1,84,0.5,0.22549019607843135,0.0,0.0
EDU_0965,306,"Programming best practices: clean code, version control, and collaborative development",0.3076923076923077,0.008688801962062648,0.008481815962899682,0.004683363877010792,0.004185520361990951,2,72,0.5,0.21568627450980393,0.0,0.5
EDU_0966,415,Web development project tutorial: building a complete e-commerce website from scratch,0.23076923076923078,0.01658051597280432,0.022475795297372057,0.014457340663815923,0.010407239819004526,2,72,0.75,0.20588235294117652,1.0,0.5
EDU_0967,109,"Data science career guide: essential skills, tools, and projects for becoming a successful data scientist in 2024",0.0,0.05172922293626401,0.07515661866406313,0.06953777234779067,0.06957013574660634,1,21,0.75,0.48039215686274517,1.0,1.0
EDU_0968,211,System design interview masterclass: scalability patterns and distributed systems architecture,0.15384615384615385,0.013767812238055323,0.025770889268570497,0.028303807778456525,0.028393665158371044,0,96,0.0,0.2941176470588235,1.0,1.0
EDU_0969,374,"Object-oriented programming: classes, inheritance, polymorphism, and design patterns",0.07692307692307693,0.030276147899785784,0.030042307379383286,0.017104459376908982,0.012782805429864255,1,111,0.25,0.196078431372549,0.0,0.5
EDU_0970,186,Flask vs Django: choosing the right Python web framework for your project needs,0.0,0.005619198410480892,0.007464811650801399,0.007228670331907962,0.0057692307692307696,2,102,0.25,0.1470588235294118,1.0,0.5
EDU_0971,318,"Python automation and scripting: automating tasks, file processing, and API integrations",0.15384615384615385,0.018783955791499798,0.039622487999349115,0.029220118102219507,0.02929864253393665,0,115,0.0,0.23529411764705888,0.0,0.5
EDU_0972,357,"Database fundamentals: normalization, indexing, transactions, and performance tuning strategies",0.38461538461538464,0.034925956971221014,0.0393377267919616,0.024231317450621057,0.019570135746606335,1,49,0.25,0.303921568627451,1.0,0.5
EDU_0973,63,"Career transition to tech: portfolio building, networking, and landing your first developer job",0.07692307692307693,0.0,0.0029086323326010903,0.00285074322948483,0.00248868778280543,2,36,0.0,0.303921568627451,0.0,0.5
EDU_0974,12,"Algorithm design techniques: divide and conquer, dynamic programming, and greedy algorithms",0.07692307692307693,0.04343547235416473,0.04371084533398421,0.0285074322948483,0.025,1,12,0.5,0.2647058823529411,1.0,0.5
EDU_0975,401,"Modern web development practices: responsive design, performance optimization, and deployment strategies",0.07692307692307693,0.0004253205426717581,0.00380359612724758,0.002443494196701283,0.0018099547511312218,1,48,0.25,0.392156862745098,0.0,0.5
EDU_0976,128,Database backup and recovery: disaster recovery planning and data protection strategies,0.3076923076923077,0.061243829747601744,0.06622732080384021,0.044288332315210746,0.03936651583710407,0,114,0.25,0.22549019607843135,0.0,0.5
EDU_0977,369,"Software architecture patterns: MVC, microservices, and designing maintainable systems",0.07692307692307693,0.009127316755145758,0.012814254332438369,0.009875789045001018,0.008031674208144797,1,100,0.0,0.21568627450980393,1.0,0.5
EDU_0978,306,"Object-oriented programming: classes, inheritance, polymorphism, and design patterns",0.07692307692307693,0.008593337679674646,0.012122691400211537,0.0076359193646915085,0.006447963800904978,0,96,0.25,0.196078431372549,0.0,0.5
EDU_0979,207,System design interview masterclass: scalability patterns and distributed systems architecture,0.15384615384615385,0.04494116916581292,0.07688552599463022,0.07920993687639992,0.0746606334841629,0,84,0.0,0.2941176470588235,1.0,1.0
EDU_0980,54,"Algorithm and data structures: arrays, linked lists, trees, graphs, and sorting algorithms",0.15384615384615385,0.022947129862469343,0.02782523797900903,0.021686010995723887,0.017760180995475116,0,70,0.5,0.2549019607843137,1.0,0.5
EDU_0981,137,"Database security: access control, encryption, and protecting sensitive information",0.15384615384615385,0.0,0.002928972418843056,0.0030543677458766036,0.0029411764705882353,1,60,0.25,0.18627450980392157,1.0,1.0
EDU_0982,401,Frontend and backend development: creating dynamic web applications with modern frameworks and tools,0.07692307692307693,0.034925956971221014,0.03002196729314132,0.025147627774384035,0.020927601809954753,1,14,0.25,0.3529411764705882,0.0,0.5
EDU_0983,88,"Algorithm and data structures: arrays, linked lists, trees, graphs, and sorting algorithms",0.23076923076923078,0.04627223619260501,0.05074851517370434,0.026369374872734677,0.01979638009049774,0,96,0.5,0.2549019607843137,0.0,0.0
EDU_0984,277,"MongoDB Atlas: cloud database management, scaling, and production deployment strategies",0.15384615384615385,0.021959113346372357,0.020482466845659422,0.011810221950722866,0.008031674208144797,2,131,0.25,0.22549019607843135,1.0,0.5
EDU_0985,22,"Data analytics career guide: tools, skills, and projects for becoming a successful data analyst",0.15384615384615385,0.06127254664555587,0.09982914327556748,0.08990022398696802,0.08495475113122172,0,24,0.75,0.303921568627451,1.0,1.0
EDU_0986,206,"Technical interview preparation: algorithms, data structures, and system design concepts",0.15384615384615385,0.013326969047840802,0.0243470832316329,0.02412950519242517,0.02420814479638009,0,96,0.5,0.23529411764705888,0.0,0.5
EDU_0987,358,"SQL mastery course: database design, query optimization, and advanced SQL techniques",0.15384615384615385,0.11253919468504547,0.15838825156618663,0.156485440847078,0.14683257918552037,0,0,0.5,0.196078431372549,1.0,0.5
EDU_0988,142,Machine learning project tutorial: building end-to-end ML pipelines from data preprocessing to model deployment and monitoring,0.15384615384615385,0.04233724504051411,0.022170694003742573,0.014457340663815923,0.00916289592760181,2,116,1.0,0.607843137254902,0.0,0.5
EDU_0989,291,"Algorithm design techniques: divide and conquer, dynamic programming, and greedy algorithms",0.15384615384615385,0.0328862810841017,0.018346757790253028,0.008043168397475054,0.005316742081447964,2,138,0.5,0.2647058823529411,0.0,0.0
EDU_0990,88,"Algorithm and data structures: arrays, linked lists, trees, graphs, and sorting algorithms",0.4615384615384616,0.0023283971314147344,0.0020746887966804975,0.000916310323762981,0.00045248868778280545,0,84,0.5,0.2549019607843137,0.0,0.0
EDU_0991,291,"Advanced algorithms: graph algorithms, string matching, and computational complexity analysis",0.15384615384615385,0.027243798702306664,0.0351883491986006,0.025147627774384035,0.0248868778280543,0,71,0.5,0.28431372549019607,0.0,0.0
EDU_0992,108,"Data science career guide: essential skills, tools, and projects for becoming a successful data scientist in 2024",0.3076923076923077,0.008449753189904069,0.013302416402245545,0.0123192832417023,0.010633484162895928,0,73,0.75,0.48039215686274517,1.0,0.5
EDU_0993,142,Machine learning project tutorial: building end-to-end ML pipelines from data preprocessing to model deployment and monitoring,0.07692307692307693,0.00013582316599919288,0.0028069319013912615,0.0021380574221136228,0.0014705882352941176,1,82,1.0,0.607843137254902,0.0,0.5
EDU_0994,25,"Artificial intelligence fundamentals: understanding AI concepts, applications, and future implications in various industries",0.15384615384615385,0.0023136506162491077,0.004698559921894069,0.003257992262268377,0.002601809954751131,0,96,0.0,0.588235294117647,0.0,0.5
EDU_0995,291,"Software development lifecycle: planning, coding, testing, and maintaining quality code",0.07692307692307693,0.034925956971221014,0.04763648197868359,0.040826715536550595,0.03676470588235294,0,136,0.5,0.22549019607843135,0.0,0.0
EDU_0996,345,SQL project tutorial: designing and implementing a complete database system from scratch,0.4615384615384616,0.008384558070224458,0.010271743552192661,0.008755854204846262,0.007352941176470589,0,36,0.75,0.23529411764705888,1.0,1.0
EDU_0997,22,"Business analytics with Python: data visualization, statistical analysis, and creating actionable insights from data",0.23076923076923078,0.01517494023780696,0.02054348710438532,0.020158827122785584,0.020135746606334843,0,96,0.5,0.5098039215686274,1.0,1.0
EDU_0998,156,"DevOps monitoring: logging, metrics, alerting, and maintaining system reliability",0.07692307692307693,0.0,0.003600195264827923,0.0025453064548971696,0.002149321266968326,0,47,0.0,0.16666666666666663,1.0,0.5
EDU_0999,142,Deep dive into machine learning algorithms: supervised and unsupervised learning techniques with practical Python implementations,0.0,0.07917559218900376,0.09301521438450899,0.047037263286499695,0.040271493212669686,1,0,0.5,0.6372549019607843,0.0,0.5
EDU_1000,128,"Database security: access control, encryption, and protecting sensitive information",0.0,0.09588028934215019,0.12999349117240255,0.1108735491753207,0.10486425339366516,0,93,0.25,0.18627450980392157,0.0,0.5
EDU_1001,348,"SQL mastery course: database design, query optimization, and advanced SQL techniques",0.23076923076923078,0.010948899444289218,0.020706207794321044,0.018937080024434942,0.01742081447963801,0,74,0.5,0.196078431372549,1.0,1.0
EDU_1002,119,"Advanced data structures: heaps, tries, segment trees, and specialized data structures",0.07692307692307693,0.0016337586538760053,0.008420795704173785,0.00916310323762981,0.00916289592760181,0,73,0.25,0.21568627450980393,1.0,1.0
EDU_1003,318,"Python automation and scripting: automating tasks, file processing, and API integrations",0.15384615384615385,0.045886498401167305,0.08028232039703848,0.09600895947872123,0.09309954751131222,0,131,0.0,0.23529411764705888,0.0,0.5
EDU_1004,343,"Database fundamentals: normalization, indexing, transactions, and performance tuning strategies",0.07692307692307693,0.022468256185775047,0.04533805223334147,0.045001018122581955,0.04502262443438914,0,12,0.25,0.303921568627451,0.0,0.5
EDU_1005,28,"AI project development: building intelligent systems using Python, TensorFlow, and modern AI frameworks",0.6923076923076923,0.00034615504020365714,0.002237409486616223,0.0016289961311341885,0.0010180995475113123,1,84,0.5,0.38235294117647056,1.0,1.0
EDU_1006,25,"Artificial intelligence fundamentals: understanding AI concepts, applications, and future implications in various industries",0.23076923076923078,0.027720343981869545,0.02912700349849483,0.016697210344125434,0.011538461538461539,2,12,0.0,0.588235294117647,0.0,0.5
EDU_1007,301,"PostgreSQL with Python: database integration, ORM usage, and building data-driven applications",0.0,0.01591692279035112,0.03341876169554959,0.040623091020158826,0.04061085972850679,0,113,0.25,0.2941176470588235,1.0,1.0
EDU_1008,171,"Django REST framework: creating APIs, serializers, authentication, and API documentation",0.07692307692307693,0.0016523858309273227,0.006163046131315597,0.004785176135206679,0.004864253393665159,0,36,0.0,0.23529411764705888,0.0,0.5
EDU_1009,343,"Database administration: backup, recovery, security, and maintaining database performance",0.15384615384615385,0.00644655552451026,0.012346432348873159,0.01293015679087762,0.011199095022624435,0,72,0.25,0.2450980392156863,0.0,0.5
EDU_1010,197,"Frontend performance optimization: code splitting, lazy loading, and bundle optimization techniques",0.4615384615384616,0.03474667039210207,0.03941908713692946,0.028100183262064753,0.018552036199095023,0,13,0.0,0.3431372549019608,0.0,0.5
EDU_1011,197,"Building interactive user interfaces: state management, component design, and user experience best practices",0.23076923076923078,0.003050200242153302,0.005593523716540558,0.0026471187130930563,0.0023755656108597287,0,131,0.0,0.43137254901960786,0.0,0.5
EDU_1012,101,"Advanced data science techniques: exploratory data analysis with pandas, statistical modeling, and machine learning pipeline development using Python and scikit-learn",0.3076923076923077,0.001627549594858899,0.006488487511187047,0.005192425167990226,0.0046380090497737565,1,96,1.0,1.0,0.0,0.5
EDU_1013,155,"Container orchestration: Docker Swarm, Kubernetes, and managing microservices at scale",0.23076923076923078,0.07658951910837912,0.05617931820030917,0.020973325188352678,0.016402714932126698,2,0,0.0,0.21568627450980393,0.0,0.5
EDU_1014,344,"Database administration: backup, recovery, security, and maintaining database performance",0.15384615384615385,0.015316196330446123,0.03006264746562525,0.028303807778456525,0.02567873303167421,0,135,0.25,0.2450980392156863,1.0,0.5
EDU_1015,25,"AI project development: building intelligent systems using Python, TensorFlow, and modern AI frameworks",0.15384615384615385,0.01791701592623638,0.025120006508827595,0.017817145184280188,0.011312217194570137,0,92,0.5,0.38235294117647056,0.0,0.5
EDU_1016,343,"SQL for data analysis: complex queries, window functions, and analytical functions for business intelligence",0.38461538461538464,0.016397348731799696,0.019994304775852248,0.019955202606393812,0.01742081447963801,1,108,0.5,0.43137254901960786,0.0,0.5
EDU_1017,37,"Building RESTful APIs: Node.js, Express, database integration, and API design best practices",0.07692307692307693,0.051177392816118716,0.041595476364819785,0.024842190999796378,0.021832579185520364,1,12,0.25,0.27450980392156865,0.0,0.5
EDU_1018,291,"Programming best practices: clean code, version control, and collaborative development",0.07692307692307693,0.003918692372170998,0.007342771133349605,0.005803298717165547,0.0057692307692307696,0,128,0.5,0.21568627450980393,0.0,0.0
EDU_1019,306,"Algorithm and data structures: arrays, linked lists, trees, graphs, and sorting algorithms",0.15384615384615385,0.034925956971221014,0.04116833455373851,0.02280594583587864,0.019457013574660634,0,81,0.5,0.2549019607843137,0.0,0.5
EDU_1020,385,"Object-oriented programming: classes, inheritance, polymorphism, and design patterns",0.23076923076923078,0.009156809785477012,0.014177040110650069,0.011199348401547545,0.00916289592760181,1,60,0.25,0.196078431372549,1.0,1.0
EDU_1021,233,"JavaScript frameworks and libraries: React, Vue, Angular, and choosing the right tool for your project",0.15384615384615385,0.015522647542764896,0.030591489707916357,0.03410710649562207,0.034162895927601813,0,84,0.25,0.37254901960784315,1.0,1.0
EDU_1022,242,"Machine learning for beginners: understanding algorithms, choosing the right model, and avoiding common pitfalls",0.07692307692307693,0.02790972028189128,0.05211130095191604,0.061189167175727956,0.06119909502262444,0,108,0.5,0.47058823529411775,0.0,0.5
EDU_1023,13,"Business analytics with Python: data visualization, statistical analysis, and creating actionable insights from data",0.3076923076923077,0.0,0.0022577495728581887,0.0012217470983506412,0.0010180995475113123,0,131,0.5,0.5098039215686274,0.0,0.5
EDU_1024,393,"Database design for scale: sharding, replication, and handling large-scale data systems",0.07692307692307693,0.006425599950327528,0.0066512082011227725,0.0036652412950519244,0.002601809954751131,2,0,0.25,0.22549019607843135,0.0,0.5
EDU_1025,365,"Software engineering best practices: clean code, testing, and agile development methodologies",0.07692307692307693,0.0,0.0019119681067447725,0.0015271838729383016,0.0011312217194570137,1,48,0.25,0.28431372549019607,1.0,0.5
EDU_1026,124,Memory management: understanding how data structures work at the hardware level,0.6923076923076923,0.002377293471174444,0.0015458465543893905,0.0007126858073712076,0.0005656108597285067,0,59,0.25,0.1470588235294118,1.0,0.5
EDU_1027,128,"Database trends: NoSQL, NewSQL, and modern database technologies",0.07692307692307693,0.0055097637453044,0.008603856480351476,0.007126858073712075,0.006674208144796381,0,72,0.25,0.0,0.0,0.5
EDU_1028,176,"Django project structure: models, views, templates, and following Django best practices",0.07692307692307693,0.0,0.004942640956797657,0.004988800651598452,0.00497737556561086,0,120,0.25,0.22549019607843135,1.0,1.0
EDU_1029,171,Django security: protecting against common vulnerabilities and implementing secure authentication,0.3076923076923077,0.00861739778336593,0.01023106337970873,0.0076359193646915085,0.006447963800904978,0,72,0.0,0.32352941176470584,0.0,0.5
EDU_1030,217,System design interview masterclass: scalability patterns and distributed systems architecture,0.15384615384615385,0.10948977057526932,0.1927019770563827,0.2326410099776013,0.23076923076923078,0,36,0.0,0.2941176470588235,1.0,1.0
EDU_1031,206,System design interview masterclass: scalability patterns and distributed systems architecture,0.0,0.008076433516500576,0.01936376210235131,0.021075137446548566,0.021153846153846155,0,65,0.0,0.2941176470588235,0.0,0.5
EDU_1032,374,"Programming best practices: clean code, version control, and collaborative development",0.0,0.19420461953990872,0.2206695956390855,0.14050091631032377,0.10135746606334842,2,98,0.5,0.21568627450980393,0.0,0.5
EDU_1033,216,"Technical interview preparation: algorithms, data structures, and system design concepts",0.07692307692307693,0.015522647542764896,0.03327638109185583,0.03685603746691101,0.03687782805429864,0,115,0.5,0.23529411764705888,1.0,1.0
EDU_1034,128,"Database security: access control, encryption, and protecting sensitive information",0.23076923076923078,0.0025969389339045666,0.005430803026604833,0.003868865811443698,0.0027149321266968325,0,60,0.25,0.18627450980392157,0.0,0.5
EDU_1035,393,"Distributed systems architecture: microservices, load balancing, and fault tolerance strategies",0.15384615384615385,0.003536835242618981,0.006346106907493288,0.0031561800040724904,0.0027149321266968325,0,24,0.0,0.303921568627451,0.0,0.5
EDU_1036,278,Node.js development course: building scalable server-side applications with JavaScript,0.0,0.199253360653193,0.1876169554958913,0.17145184280187334,0.15305429864253395,0,24,0.5,0.21568627450980393,0.0,0.5
EDU_1037,10,"Algorithm optimization: time and space complexity, profiling, and performance improvement",0.0,0.00013039023935922534,0.0044137987145065494,0.004785176135206679,0.004072398190045249,0,24,0.25,0.2450980392156863,1.0,0.5
EDU_1038,220,"Software development lifecycle: planning, coding, testing, and maintaining quality code",0.15384615384615385,0.022604079351774237,0.023553819868196237,0.016289961311341885,0.012782805429864255,1,0,0.5,0.22549019607843135,1.0,0.5
EDU_1039,81,"Cloud migration: moving applications to the cloud, modernization, and optimization techniques",0.07692307692307693,0.019205395672285866,0.02237409486616223,0.021380574221136227,0.01911764705882353,0,75,0.0,0.28431372549019607,1.0,0.5
EDU_1040,37,"Backend security: authentication, authorization, data validation, and protecting against common vulnerabilities",1.0000000000000002,0.0,0.0,0.0,0.0,0,124,0.25,0.4607843137254901,0.0,0.5
EDU_1041,149,Machine learning project tutorial: building end-to-end ML pipelines from data preprocessing to model deployment and monitoring,0.15384615384615385,0.006913787215547483,0.009193718981368481,0.005905110975361434,0.005656108597285069,0,129,1.0,0.607843137254902,1.0,0.5
EDU_1042,25,"AI project development: building intelligent systems using Python, TensorFlow, and modern AI frameworks",0.0,0.02214771351401695,0.02607599056219998,0.017002647118713094,0.015158371040723984,0,48,0.5,0.38235294117647056,0.0,0.5
EDU_1043,116,Data structures in practice: choosing the right structure for different problem types,0.23076923076923078,2.6388500822700604e-05,0.002379790090309983,0.0014253716147424149,0.0013574660633484162,0,47,0.25,0.20588235294117652,1.0,1.0
EDU_1044,112,Data structures in practice: choosing the right structure for different problem types,0.0,0.0023283971314147344,0.006915629322268326,0.005905110975361434,0.005429864253393666,0,0,0.25,0.20588235294117652,0.0,0.5
EDU_1045,291,Flask vs Django: choosing the right Python web framework for your project needs,0.23076923076923078,0.010889137251249573,0.013078675453583924,0.00916310323762981,0.007013574660633485,0,14,0.25,0.1470588235294118,0.0,0.0
EDU_1046,291,Competitive programming: problem-solving strategies and advanced algorithmic techniques,0.0,0.0,0.002827271987633227,0.0022398696803095095,0.0014705882352941176,2,72,0.5,0.22549019607843135,0.0,0.0
EDU_1047,291,"Programming fundamentals: variables, functions, control structures, and problem-solving techniques",0.3076923076923077,0.045572940920803454,0.05093157594988203,0.028711056811240074,0.021945701357466065,1,84,0.25,0.33333333333333337,0.0,0.0
