EDU_0316,291,"MongoDB Atlas: cloud database management, scaling, and production deployment strategies",0.07692307692307693,0.07328707584365589,0.07450573590432023,0.04184483811850947,0.02986425339366516,2,108,0.25,0.22549019607843135,0.0,0.0
EDU_0317,228,"JavaScript testing and debugging: unit testing, integration testing, and debugging techniques",0.3076923076923077,0.0011641985657073672,0.005654543975266455,0.004886988393402566,0.00497737556561086,0,9,0.0,0.28431372549019607,0.0,0.5
EDU_0318,242,"Machine learning for beginners: understanding algorithms, choosing the right model, and avoiding common pitfalls",0.3076923076923077,0.0667768774642203,0.09799853551379058,0.09102015882712278,0.07669683257918553,0,84,0.5,0.47058823529411775,0.0,0.5
EDU_0319,306,"Object-oriented programming: classes, inheritance, polymorphism, and design patterns",0.3076923076923077,0.013896650212660271,0.016190708648604668,0.012421095499898187,0.00916289592760181,0,120,0.25,0.196078431372549,0.0,0.5
EDU_0320,392,"Object-oriented programming: classes, inheritance, polymorphism, and design patterns",0.0,0.005830306417062493,0.012000650882759742,0.010588474852372225,0.010633484162895928,0,120,0.25,0.196078431372549,1.0,1.0
EDU_0321,155,"DevOps monitoring: logging, metrics, alerting, and maintaining system reliability",0.07692307692307693,0.013546614510570924,0.014848262956634935,0.008450417430258603,0.007013574660633485,0,84,0.0,0.16666666666666663,0.0,0.5
EDU_0322,395,"System design patterns: caching, message queues, and event-driven architecture",0.3076923076923077,0.012200800968613208,0.013343096574729476,0.008043168397475054,0.006674208144796381,0,96,0.0,0.13725490196078427,1.0,0.5
EDU_0323,88,"Object-oriented programming: classes, inheritance, polymorphism, and design patterns",0.23076923076923078,0.1082068237558598,0.07354975185094785,0.06027285685196497,0.04796380090497738,0,0,0.25,0.196078431372549,0.0,0.0
EDU_0324,197,"Responsive web design: creating mobile-first, accessible websites with CSS Grid and Flexbox",0.23076923076923078,0.0,0.0021153689691644295,0.0016289961311341885,0.001583710407239819,0,36,0.0,0.2647058823529411,0.0,0.5
EDU_0325,389,"Programming best practices: clean code, version control, and collaborative development",0.15384615384615385,0.014272298283195182,0.021580831502725568,0.018529830991651397,0.014705882352941178,1,72,0.5,0.21568627450980393,1.0,1.0
EDU_0326,44,"Backend development fundamentals: APIs, databases, authentication, and server-side programming",0.38461538461538464,0.01890813697184192,0.017044992270767226,0.01007941356139279,0.006221719457013575,2,108,0.75,0.2941176470588235,1.0,1.0
EDU_0327,306,"Software development lifecycle: planning, coding, testing, and maintaining quality code",0.07692307692307693,0.05378830213281177,0.049243348791798876,0.03257992262268377,0.028506787330316745,0,96,0.5,0.22549019607843135,0.0,0.5
EDU_0328,346,"SQL mastery course: database design, query optimization, and advanced SQL techniques",0.15384615384615385,0.02741066716339139,0.04322268326417704,0.035023416819385055,0.03246606334841629,0,0,0.5,0.196078431372549,1.0,1.0
EDU_0329,171,"Django REST framework: creating APIs, serializers, authentication, and API documentation",0.38461538461538464,0.0005852038123622368,0.0021763892278903263,0.00030543677458766036,0.0002262443438914027,0,47,0.0,0.23529411764705888,0.0,0.5
EDU_0330,242,"Machine learning for beginners: understanding algorithms, choosing the right model, and avoiding common pitfalls",0.07692307692307693,0.0,0.0006508827597429014,0.0007126858073712076,0.0005656108597285067,2,12,0.5,0.47058823529411775,0.0,0.5
EDU_0331,361,"Database fundamentals: normalization, indexing, transactions, and performance tuning strategies",0.23076923076923078,0.003052528639284717,0.011288747864290944,0.010792099368763998,0.00984162895927602,0,39,0.25,0.303921568627451,1.0,1.0
EDU_0332,25,"AI project development: building intelligent systems using Python, TensorFlow, and modern AI frameworks",0.15384615384615385,0.014634752103318743,0.016577170287202014,0.014151903889228263,0.014140271493212671,0,106,0.5,0.38235294117647056,0.0,0.5
EDU_0333,336,"React development course: components, hooks, state management, and building scalable applications",0.23076923076923078,0.016494365278941978,0.02987958668944756,0.022602321319486866,0.019343891402714933,0,25,0.5,0.32352941176470584,1.0,1.0
EDU_0334,251,"Mobile app deployment: app store optimization, testing, and release management",0.15384615384615385,0.011919064915712024,0.014726222439183142,0.012217470983506413,0.012217194570135748,0,12,0.0,0.13725490196078427,0.0,0.5
EDU_0335,38,"Building RESTful APIs: Node.js, Express, database integration, and API design best practices",0.07692307692307693,0.0,0.002542510780245708,0.0016289961311341885,0.0013574660633484162,1,96,0.25,0.27450980392156865,1.0,0.5
EDU_0336,328,"Python web development: building dynamic websites with Django, Flask, and modern Python frameworks",0.07692307692307693,0.014068175468007822,0.027174355219266127,0.024842190999796378,0.023076923076923078,1,89,0.25,0.33333333333333337,1.0,1.0
EDU_0337,325,"Python web development: building dynamic websites with Django, Flask, and modern Python frameworks",0.15384615384615385,0.0,0.0014848262956634938,0.0016289961311341885,0.0016968325791855204,0,71,0.25,0.33333333333333337,1.0,1.0
EDU_0338,278,"Node.js ecosystem: npm packages, database integration, and real-time applications with Socket.io",0.0,0.041807922759305824,0.06488487511187047,0.05976379556098554,0.05984162895927602,0,91,0.25,0.3137254901960784,0.0,0.5
EDU_0339,343,"Database administration: backup, recovery, security, and maintaining database performance",0.07692307692307693,0.05962016081462854,0.10316491741924985,0.11657503563429036,0.1166289592760181,0,120,0.25,0.2450980392156863,0.0,0.5
EDU_0340,291,"Object-oriented programming: classes, inheritance, polymorphism, and design patterns",0.0,0.034984166899506376,0.04385322593767797,0.030950926491549582,0.02420814479638009,1,60,0.25,0.196078431372549,0.0,0.0
EDU_0341,343,"SQL mastery course: database design, query optimization, and advanced SQL techniques",0.07692307692307693,0.0038845425475769147,0.011146367260597185,0.012522907758094073,0.012556561085972851,0,105,0.5,0.196078431372549,0.0,0.5
EDU_0342,229,"Node.js backend development: building APIs, handling databases, and creating server-side applications",0.0,0.005730961472788798,0.01875355951509234,0.01903889228263083,0.01900452488687783,0,84,0.5,0.36274509803921573,1.0,1.0
EDU_0343,140,Database backup and recovery: disaster recovery planning and data protection strategies,0.07692307692307693,0.04193132780727081,0.053514766902611664,0.04123396456933415,0.03812217194570136,0,36,0.25,0.22549019607843135,1.0,1.0
EDU_0344,74,"Cloud migration: moving applications to the cloud, modernization, and optimization techniques",0.23076923076923078,0.0023283971314147344,0.004027337075909202,0.0012217470983506412,0.0011312217194570137,2,105,0.0,0.28431372549019607,0.0,0.5
EDU_0345,275,"MongoDB development: NoSQL database design, document modeling, and query optimization",0.15384615384615385,0.011891124150135046,0.012000650882759742,0.010893911626959886,0.009276018099547511,2,60,0.5,0.20588235294117652,1.0,0.5
EDU_0346,180,"Django REST framework: creating APIs, serializers, authentication, and API documentation",0.4615384615384616,0.011454161621806215,0.019485802619803105,0.016595398085929546,0.0166289592760181,0,60,0.0,0.23529411764705888,1.0,1.0
EDU_0347,25,"AI career roadmap: essential skills, certifications, and projects for becoming an AI engineer",0.07692307692307693,0.049660054018813446,0.04637539663168172,0.026776623905518226,0.020361990950226245,0,84,0.25,0.28431372549019607,0.0,0.5
EDU_0348,206,Coding interview bootcamp: problem-solving techniques and whiteboard coding strategies,0.3076923076923077,0.0038007202508459842,0.007200390529655845,0.005803298717165547,0.00497737556561086,2,24,0.25,0.21568627450980393,0.0,0.5
EDU_0349,350,SQL project tutorial: designing and implementing a complete database system from scratch,0.07692307692307693,0.0007264599050013972,0.006285086648767391,0.004479739360619019,0.004411764705882354,1,0,0.75,0.23529411764705888,1.0,0.5
EDU_0350,100,"Programming best practices: clean code, version control, and collaborative development",0.23076923076923078,0.020865542826984572,0.023228378488324788,0.01293015679087762,0.008936651583710408,0,24,0.5,0.21568627450980393,1.0,0.0
EDU_0351,171,Django web development: building robust web applications with Python's most popular framework,0.07692307692307693,0.2565676321753438,0.28303230005695224,0.25707595194461413,0.2256787330316742,1,97,0.25,0.28431372549019607,0.0,0.5
EDU_0352,144,Deep dive into machine learning algorithms: supervised and unsupervised learning techniques with practical Python implementations,0.23076923076923078,0.036975722579243114,0.03158815393377268,0.022093260028507433,0.01809954751131222,0,36,0.5,0.6372549019607843,1.0,1.0
EDU_0353,0,"Algorithm design techniques: divide and conquer, dynamic programming, and greedy algorithms",0.07692307692307693,0.022233864207879296,0.021845252623871124,0.008450417430258603,0.0067873303167420825,2,131,0.5,0.2647058823529411,1.0,0.5
EDU_0354,183,"Flask API development: creating RESTful services, handling JSON data, and API documentation",0.15384615384615385,0.04104576076495607,0.0440159466276137,0.0384850335980452,0.02567873303167421,0,24,0.5,0.2647058823529411,1.0,0.5
EDU_0355,83,"AWS cloud computing: EC2, S3, Lambda, and serverless architecture implementation guide",0.23076923076923078,0.01841606904473627,0.023716540558131962,0.022093260028507433,0.021832579185520364,0,117,0.25,0.21568627450980393,1.0,1.0
EDU_0356,145,Machine learning project tutorial: building end-to-end ML pipelines from data preprocessing to model deployment and monitoring,0.15384615384615385,0.010849554500015523,0.02054348710438532,0.01964976583180615,0.01968325791855204,0,122,1.0,0.607843137254902,1.0,1.0
EDU_0357,291,"Algorithm optimization: time and space complexity, profiling, and performance improvement",0.23076923076923078,0.02029198100027941,0.022130013831258642,0.01486458969659947,0.011990950226244345,0,50,0.25,0.2450980392156863,0.0,0.0
EDU_0358,206,"Interview success strategies: preparation techniques, mock interviews, and confidence building",0.0,0.0009779267951941888,0.008013993979334472,0.010486662594176337,0.010520361990950227,0,72,0.0,0.2941176470588235,0.0,0.5
EDU_0359,171,"Django deployment: configuring production environments, database optimization, and scaling applications",0.07692307692307693,0.02641023252926019,0.01641444959726629,0.009061290979433922,0.008371040723981902,1,22,0.25,0.38235294117647056,0.0,0.5
EDU_0360,125,Data structures in practice: choosing the right structure for different problem types,0.15384615384615385,0.3173465586290397,0.3282483117728419,0.2325391977194054,0.17952488687782805,0,44,0.25,0.20588235294117652,1.0,1.0
EDU_0361,253,"Mobile development career: skills, tools, and opportunities in the mobile app industry",0.23076923076923078,0.07288891993418398,0.10428362216255796,0.08796579108124618,0.059049773755656114,2,12,0.25,0.21568627450980393,1.0,1.0
EDU_0362,13,"Analytics project walkthrough: cleaning data, performing statistical tests, and creating compelling visualizations",0.15384615384615385,0.00040591723324330184,0.0034781547473761287,0.0026471187130930563,0.0022624434389140274,1,84,0.5,0.4901960784313726,0.0,0.5
EDU_0363,224,"Algorithm and data structures: arrays, linked lists, trees, graphs, and sorting algorithms",0.15384615384615385,0.048590543603116945,0.061528760881946136,0.04489920586438607,0.041176470588235294,2,24,0.5,0.2549019607843137,1.0,0.5
EDU_0364,101,"Data science project walkthrough: cleaning messy datasets, feature engineering, and building predictive models with real-world business applications",0.23076923076923078,0.210262798422899,0.2746115043527784,0.26379556098554263,0.25384615384615383,0,96,0.5,0.8235294117647058,0.0,0.5
EDU_0365,188,Flask web development: building lightweight web applications with Python's flexible framework,0.23076923076923078,0.0007210269783614297,0.0061020258725897,0.005396049684382,0.005429864253393666,0,48,0.25,0.28431372549019607,1.0,0.5
EDU_0366,251,Native mobile development: iOS with Swift and Android with Kotlin for platform-specific apps,0.15384615384615385,0.005789947533451305,0.008339435359205923,0.004886988393402566,0.0029411764705882353,2,35,0.25,0.27450980392156865,0.0,0.5
EDU_0367,215,"Technical interview preparation: algorithms, data structures, and system design concepts",0.0,0.005006829964918817,0.009030998291432755,0.007432294848299735,0.00746606334841629,2,134,0.5,0.23529411764705888,1.0,1.0
EDU_0368,393,"System design fundamentals: scalability, reliability, and performance optimization principles",0.0,0.06625609263916053,0.08563176307867545,0.05019344329057218,0.04072398190045249,0,108,0.0,0.28431372549019607,0.0,0.5
EDU_0369,171,Django security: protecting against common vulnerabilities and implementing secure authentication,0.15384615384615385,0.0,0.0009559840533723864,0.0008144980655670943,0.0009049773755656109,2,78,0.0,0.32352941176470584,0.0,0.5
EDU_0370,374,"Programming best practices: clean code, version control, and collaborative development",0.15384615384615385,0.012678122380553228,0.019790903913432592,0.013541030340052941,0.010633484162895928,2,108,0.5,0.21568627450980393,0.0,0.5
EDU_0371,171,"Django REST framework: creating APIs, serializers, authentication, and API documentation",0.3076923076923077,0.0422091831982863,0.04417866731754943,0.028405620036652413,0.021040723981900454,1,12,0.0,0.23529411764705888,0.0,0.5
EDU_0372,206,Coding interview bootcamp: problem-solving techniques and whiteboard coding strategies,0.23076923076923078,0.006807457079879544,0.012793914246196404,0.010893911626959886,0.010972850678733033,0,36,0.25,0.21568627450980393,0.0,0.5
EDU_0373,72,"Tech industry insights: market trends, in-demand skills, and future career opportunities",0.38461538461538464,0.007858340318524726,0.010210723293466764,0.007941356139279168,0.008031674208144797,0,36,0.0,0.23529411764705888,1.0,1.0
EDU_0374,117,Memory management: understanding how data structures work at the hardware level,0.23076923076923078,0.00345766974015088,0.007810593116914816,0.005192425167990226,0.0047511312217194575,0,24,0.25,0.1470588235294118,1.0,1.0
EDU_0375,374,"Object-oriented programming: classes, inheritance, polymorphism, and design patterns",0.23076923076923078,0.0,0.0013831258644536654,0.0006108735491753207,0.0005656108597285067,0,67,0.25,0.196078431372549,0.0,0.5
EDU_0376,157,"DevOps culture and practices: collaboration, automation, and continuous improvement methodologies",0.23076923076923078,0.04935891465648381,0.06734602554714832,0.028914681327631846,0.022171945701357467,0,12,0.0,0.32352941176470584,1.0,1.0
EDU_0377,228,"Node.js backend development: building APIs, handling databases, and creating server-side applications",0.15384615384615385,0.0564372419359846,0.06938003417134489,0.055487680716758296,0.05147058823529412,1,12,0.5,0.36274509803921573,0.0,0.5
EDU_0378,296,"PostgreSQL optimization: indexing strategies, query planning, and database performance monitoring",0.15384615384615385,0.009886374219986959,0.015539825888861767,0.014762777438403582,0.014479638009049774,1,36,0.25,0.32352941176470584,1.0,1.0
EDU_0379,195,Flask project tutorial: building a complete web application from database design to deployment,0.38461538461538464,0.034925956971221014,0.024753884956472214,0.013642842598248828,0.010067873303167421,1,8,0.75,0.2941176470588235,1.0,0.5
EDU_0380,38,"Backend development with Python: Django, Flask, database management, and deployment strategies",0.23076923076923078,0.0004020365713576111,0.0032950939711984375,0.0021380574221136228,0.0016968325791855204,0,96,0.5,0.2941176470588235,1.0,0.5
EDU_0381,88,"Algorithm and data structures: arrays, linked lists, trees, graphs, and sorting algorithms",0.07692307692307693,0.0285717611995902,0.03335774143682369,0.02250050906129098,0.01900452488687783,1,61,0.5,0.2549019607843137,0.0,0.0
EDU_0382,291,"Algorithm optimization: time and space complexity, profiling, and performance improvement",0.15384615384615385,0.009925180838843872,0.015641526320071594,0.01262472001628996,0.012669683257918552,0,27,0.25,0.2450980392156863,0.0,0.0
EDU_0383,52,"Backend development fundamentals: APIs, databases, authentication, and server-side programming",0.3076923076923077,0.007602992766446245,0.01069888536327394,0.006617796782732641,0.005316742081447964,0,29,0.75,0.2941176470588235,1.0,1.0
EDU_0384,85,"Cloud migration: moving applications to the cloud, modernization, and optimization techniques",0.15384615384615385,0.0497951010524355,0.06950207468879668,0.06689065363469761,0.0583710407239819,1,62,0.0,0.28431372549019607,1.0,1.0
EDU_0385,359,"Database fundamentals: normalization, indexing, transactions, and performance tuning strategies",0.3076923076923077,0.015682530812455374,0.019628183223496864,0.01455915292201181,0.011990950226244345,1,24,0.25,0.303921568627451,1.0,1.0
EDU_0386,171,"Django project structure: models, views, templates, and following Django best practices",0.07692307692307693,0.004484492875104777,0.008807257342771133,0.004988800651598452,0.004072398190045249,0,60,0.25,0.22549019607843135,0.0,0.5
EDU_0387,291,NoSQL vs SQL: understanding when to use MongoDB and how to design effective document databases,0.23076923076923078,0.03074648412033156,0.029737206085753802,0.01201384646711464,0.009502262443438915,0,72,0.25,0.2941176470588235,0.0,0.0
EDU_0388,400,"System design fundamentals: scalability, reliability, and performance optimization principles",0.3076923076923077,0.05744233336437863,0.06974615572370027,0.05396049684381999,0.05395927601809955,1,84,0.0,0.28431372549019607,1.0,1.0
EDU_0389,1,"Algorithm design techniques: divide and conquer, dynamic programming, and greedy algorithms",0.15384615384615385,0.009691564993325262,0.016434789683508255,0.014151903889228263,0.011877828054298644,2,91,0.5,0.2647058823529411,1.0,0.5
EDU_0390,334,"React development course: components, hooks, state management, and building scalable applications",0.07692307692307693,0.002402905839620006,0.006813928891058498,0.007126858073712075,0.007126696832579186,1,19,0.5,0.32352941176470584,1.0,1.0
EDU_0391,389,"Software development lifecycle: planning, coding, testing, and maintaining quality code",0.07692307692307693,0.03368880196206265,0.054369050524774226,0.054164121360211766,0.05056561085972851,0,84,0.5,0.22549019607843135,1.0,1.0
EDU_0392,17,"Analytics project walkthrough: cleaning data, performing statistical tests, and creating compelling visualizations",0.15384615384615385,0.24902284933718297,0.17051094296639818,0.1416208511504785,0.1416289592760181,0,84,0.5,0.4901960784313726,1.0,1.0
EDU_0393,374,"Programming best practices: clean code, version control, and collaborative development",0.23076923076923078,0.020146844245754556,0.013688878040842893,0.006617796782732641,0.005203619909502263,1,55,0.5,0.21568627450980393,0.0,0.5
EDU_0394,47,"Backend development fundamentals: APIs, databases, authentication, and server-side programming",0.38461538461538464,0.004265623544751793,0.007241070702139777,0.0077377316228873965,0.00656108597285068,0,42,0.75,0.2941176470588235,1.0,1.0
EDU_0395,309,"Programming best practices: clean code, version control, and collaborative development",0.0,0.08827263978144112,0.09183548938247497,0.04204846263490124,0.029524886877828057,1,0,0.5,0.21568627450980393,1.0,1.0
EDU_0396,401,Frontend and backend development: creating dynamic web applications with modern frameworks and tools,0.23076923076923078,0.034925956971221014,0.024509803921568624,0.016086336794950112,0.010633484162895928,2,60,0.25,0.3529411764705882,0.0,0.5
EDU_0397,292,PostgreSQL vs MySQL: choosing the right relational database for your application needs,0.38461538461538464,0.015557573499736115,0.015682206492555525,0.009264915495825697,0.008371040723981902,1,128,0.25,0.21568627450980393,0.0,0.5
EDU_0398,291,NoSQL vs SQL: understanding when to use MongoDB and how to design effective document databases,0.07692307692307693,0.0537200024836236,0.05518265397445285,0.037874160048869884,0.029524886877828057,2,17,0.25,0.2941176470588235,0.0,0.0
EDU_0399,228,"Advanced JavaScript concepts: closures, prototypes, promises, and functional programming patterns",0.3076923076923077,0.057853683524261894,0.05174517939956065,0.03756872327428222,0.037556561085972856,1,131,0.25,0.32352941176470584,0.0,0.5
EDU_0400,249,"Real-world machine learning applications: computer vision, natural language processing, and recommendation systems",0.15384615384615385,0.06453463102666791,0.10304287690179806,0.12024027692934229,0.12024886877828055,0,60,0.25,0.4901960784313726,1.0,1.0
EDU_0401,241,"JavaScript complete guide: ES6+, async programming, DOM manipulation, and modern JavaScript features",0.15384615384615385,0.0279710347396852,0.047372060857538034,0.04968438199959275,0.0497737556561086,0,131,0.5,0.3529411764705882,1.0,1.0
EDU_0402,347,"SQL for data analysis: complex queries, window functions, and analytical functions for business intelligence",0.23076923076923078,0.0019589581198969294,0.006773248718574567,0.007432294848299735,0.007239819004524887,0,0,0.5,0.43137254901960786,1.0,1.0
EDU_0403,160,"DevOps culture and practices: collaboration, automation, and continuous improvement methodologies",0.07692307692307693,0.030235012883797457,0.0352493694573265,0.01964976583180615,0.016968325791855206,1,15,0.0,0.32352941176470584,1.0,1.0
EDU_0404,82,"Cloud architecture design: scalability, reliability, and cost optimization strategies",0.07692307692307693,0.0353722330880755,0.06222032381417297,0.06648340460191407,0.066289592760181,0,20,0.0,0.20588235294117652,1.0,1.0
EDU_0405,155,"Infrastructure as Code: Terraform, Ansible, and managing cloud resources with code",0.07692307692307693,0.007866101642296109,0.012366772435115124,0.006515984524536754,0.005203619909502263,0,84,0.0,0.17647058823529416,0.0,0.5
EDU_0406,25,"AI project development: building intelligent systems using Python, TensorFlow, and modern AI frameworks",0.38461538461538464,0.013351029151532086,0.004698559921894069,0.0013235593565465282,0.0009049773755656109,2,12,0.5,0.38235294117647056,0.0,0.5
EDU_0407,343,SQL project tutorial: designing and implementing a complete database system from scratch,0.15384615384615385,0.06824454378938871,0.09447970059393052,0.0970270820606801,0.09389140271493213,2,108,0.75,0.23529411764705888,0.0,0.5
EDU_0408,3,"Advanced algorithms: graph algorithms, string matching, and computational complexity analysis",0.23076923076923078,0.05641551022942473,0.054694491904645676,0.034514355528405614,0.024434389140271493,2,60,0.5,0.28431372549019607,1.0,0.5
EDU_0409,150,Deep dive into machine learning algorithms: supervised and unsupervised learning techniques with practical Python implementations,0.07692307692307693,0.0162452267858806,0.018143356927833372,0.01455915292201181,0.011877828054298644,0,72,0.5,0.6372549019607843,1.0,1.0
EDU_0410,291,"Algorithm and data structures: arrays, linked lists, trees, graphs, and sorting algorithms",0.3076923076923077,0.010846449970506971,0.01065820519079001,0.007025045815516188,0.0047511312217194575,0,96,0.5,0.2549019607843137,0.0,0.0
EDU_0411,74,"AWS cloud computing: EC2, S3, Lambda, and serverless architecture implementation guide",1.0000000000000002,0.1965275837446835,0.10788381742738588,0.023620443901445735,0.01730769230769231,0,64,0.25,0.21568627450980393,0.0,0.5
EDU_0412,84,"Cloud migration: moving applications to the cloud, modernization, and optimization techniques",0.15384615384615385,0.04233646890813697,0.025486128061182976,0.015780900020362452,0.012669683257918552,1,58,0.0,0.28431372549019607,1.0,0.5
EDU_0413,25,"AI project development: building intelligent systems using Python, TensorFlow, and modern AI frameworks",0.15384615384615385,0.02425801744745584,0.021499471157757705,0.01832620647525962,0.015271493212669685,1,63,0.5,0.38235294117647056,0.0,0.5
EDU_0414,291,"Software project management: agile methodologies, team collaboration, and delivery strategies",0.3076923076923077,0.03916286361801869,0.038422422911073145,0.01262472001628996,0.008823529411764707,1,24,0.25,0.28431372549019607,0.0,0.0
EDU_0415,292,PostgreSQL vs MySQL: choosing the right relational database for your application needs,0.15384615384615385,0.06395253174381423,0.09132698722642583,0.08430054978619425,0.08009049773755657,1,28,0.25,0.21568627450980393,0.0,0.5
EDU_0416,37,"Backend development fundamentals: APIs, databases, authentication, and server-side programming",0.23076923076923078,0.006513302908944149,0.010353103897160524,0.0076359193646915085,0.006334841628959277,1,60,0.75,0.2941176470588235,0.0,0.5
EDU_0417,278,"Advanced Node.js concepts: streams, clusters, performance optimization, and production deployment",0.23076923076923078,0.0142117599577784,0.013892278903262549,0.00600692323355732,0.0046380090497737565,1,120,0.0,0.32352941176470584,0.0,0.5
EDU_0418,310,"Object-oriented programming: classes, inheritance, polymorphism, and design patterns",0.3076923076923077,0.03527832107044177,0.030245708241802942,0.016086336794950112,0.01323529411764706,0,11,0.25,0.196078431372549,1.0,1.0
EDU_0419,251,"Mobile app deployment: app store optimization, testing, and release management",0.15384615384615385,0.017281363509360156,0.018590838825156615,0.01262472001628996,0.00916289592760181,1,36,0.0,0.13725490196078427,0.0,0.5
EDU_0420,350,SQL project tutorial: designing and implementing a complete database system from scratch,0.23076923076923078,0.034925956971221014,0.04358880481653242,0.04601914070454082,0.04513574660633484,0,131,0.75,0.23529411764705888,1.0,0.5
