EDU_0917,0.8968824940047961,"Object-oriented programming: classes, inheritance, polymorphism, and design patterns",0.15384615384615385,0.10115566110955884,0.06697990399479294,0.05039706780696396,0.050113122171945704,0.0,0.5704225352112676,0.2931127982646422,0.28429644614156135,0.07189542483660132,0.3
EDU_0918,0.4100719424460431,Django web development: building robust web applications with Python's most popular framework,0.3076923076923077,0.04459423799323212,0.028842242291107312,0.014660965180207696,0.010859728506787332,0.5,0.1619718309859155,0.19048264642082435,0.39095480557894735,0.03081232492997199,0.0
EDU_0919,0.7937649880095923,React Native mobile development: cross-platform app development with React Native and Expo,0.0,0.0,0.003945976730941339,0.004886988393402566,0.004185520361990951,0.5,0.4014084507042254,0.3150759219088938,0.3565810763904089,0.020541549953314663,0.2
EDU_0920,0.2422062350119904,"Hands-on data science workshop: working with large datasets, implementing machine learning algorithms, and creating interactive dashboards",0.38461538461538464,0.04787417341901835,0.0447278496460825,0.03481979230299328,0.029638009049773758,1.0,0.2535211267605634,0.6941431670281998,0.8055122860893507,0.10364145658263305,0.4
EDU_0921,0.21103117505995203,"Programming best practices: clean code, version control, and collaborative development",0.23076923076923078,0.10422604079351774,0.0884386949800667,0.055080431683974744,0.04807692307692308,0.0,0.2535211267605634,0.36822125813449025,0.30894322540416486,0.1372549019607843,0.03
EDU_0922,0.08872901678657073,Microservices architecture: designing scalable backend systems with containerization and orchestration,0.4615384615384616,0.017885970631150848,0.014502481490521519,0.01007941356139279,0.006108597285067874,0.0,0.08450704225352113,0.3590021691973969,0.4878534617872221,0.18207282913165265,0.2
EDU_0923,0.7338129496402878,"Programming fundamentals: variables, functions, control structures, and problem-solving techniques",0.3076923076923077,0.0045706435689671235,0.005979985355137905,0.0031561800040724904,0.0019230769230769232,1.0,0.2112676056338028,0.20878524945770072,0.44587713340227975,0.23809523809523808,0.22999999999999998
EDU_0924,0.3069544364508393,"Database security: access control, encryption, and protecting sensitive information",0.23076923076923078,0.00654434820402968,0.006834268977300464,0.0030543677458766036,0.0023755656108597287,0.5,0.3943661971830986,0.15387744034707163,0.2717547170270258,0.18207282913165265,0.3
EDU_0925,0.7937649880095923,React Native mobile development: cross-platform app development with React Native and Expo,0.3076923076923077,0.012945111918288784,0.020706207794321044,0.021380574221136227,0.021380090497737557,0.0,0.676056338028169,0.3150759219088938,0.3565810763904089,0.020541549953314663,0.2
EDU_0926,0.8968824940047961,"Programming fundamentals: variables, functions, control structures, and problem-solving techniques",0.38461538461538464,0.0,0.001037344398340249,0.0008144980655670943,0.0006787330316742081,0.0,0.8450704225352113,0.20878524945770072,0.44587713340227975,0.07189542483660132,0.3
EDU_0927,0.290167865707434,"Advanced data structures: heaps, tries, segment trees, and specialized data structures",0.15384615384615385,0.03559420694793704,0.04114799446749654,0.02728568519649766,0.026018099547511313,0.5,0.02112676056338028,0.3004338394793926,0.30894322540416486,0.6993464052287582,0.2
EDU_0928,0.32613908872901676,Database backup and recovery: disaster recovery planning and data protection strategies,0.3076923076923077,0.23501210766508335,0.20630949475225774,0.13215231113826104,0.08427601809954752,0.5,0.3380281690140845,0.30409436008676793,0.32105494285060043,0.8281979458450046,0.5
EDU_0929,0.1486810551558753,"Software development lifecycle: planning, coding, testing, and maintaining quality code",0.0,1.0,1.0,0.8357768275300346,0.7004524886877829,0.0,0.3380281690140845,0.4396691973969632,0.32105494285060043,0.31839402427637725,0.5
EDU_0930,0.7937649880095923,"React development course: components, hooks, state management, and building scalable applications",0.23076923076923078,0.004486821272236193,0.007729232771946953,0.006821421299124415,0.005656108597285069,0.5,0.471830985915493,0.4084869848156183,0.4351180182345402,0.020541549953314663,0.2
EDU_0931,0.08872901678657073,"Building RESTful APIs: Node.js, Express, database integration, and API design best practices",0.0,0.053530626183601875,0.06254576519404442,0.05538586845856241,0.053506787330316746,0.0,0.23943661971830987,0.39018438177874193,0.3796203259682276,0.18207282913165265,0.2
EDU_0932,0.12230215827338128,"Building RESTful APIs: Node.js, Express, database integration, and API design best practices",0.0,0.03163127503026916,0.04165649662354568,0.03614335165953981,0.031787330316742086,1.0,0.0,0.39018438177874193,0.3796203259682276,0.44164332399626527,0.5
EDU_0933,0.17745803357314147,"Cloud migration: moving applications to the cloud, modernization, and optimization techniques",0.23076923076923078,0.0,0.002928972418843056,0.0011199348401547545,0.0009049773755656109,0.0,0.7605633802816901,0.05490780911062909,0.39095480557894735,0.1372549019607843,0.4
EDU_0934,0.47242206235011985,JavaScript frameworks comparison: React vs Vue vs Angular for modern web development,0.0,0.05874778802272515,0.06443739321454722,0.0639380981470169,0.05723981900452489,0.5,0.9225352112676056,0.15753796095444694,0.28429644614156135,0.19327731092436976,0.2
EDU_0935,0.961630695443645,"Web development career guide: essential skills, portfolio projects, and job search strategies",0.0,0.04632966998851324,0.055202994060694816,0.04103034005294237,0.03076923076923077,0.0,0.9366197183098591,0.5294197396963125,0.39095480557894735,0.1372549019607843,0.2
EDU_0936,0.17745803357314147,"AWS cloud computing: EC2, S3, Lambda, and serverless architecture implementation guide",0.07692307692307693,0.1020963335506504,0.10800585794483768,0.09203828140908164,0.07567873303167422,0.0,0.2535211267605634,0.36822125813449025,0.30894322540416486,0.1372549019607843,0.4
EDU_0937,0.29976019184652275,"Data structures mastery: arrays, stacks, queues, linked lists, trees, and hash tables",0.0,0.018558877402129706,0.027540476771621508,0.018529830991651397,0.01832579185520362,0.0,0.33098591549295775,0.1611984815618222,0.29669148500165754,0.5032679738562092,0.3
EDU_0938,0.961630695443645,Frontend and backend development: creating dynamic web applications with modern frameworks and tools,0.15384615384615385,0.0,0.0037425758685216822,0.0036652412950519244,0.0030542986425339366,0.0,0.3380281690140845,0.21610629067245124,0.46707311478370617,0.1372549019607843,0.2
EDU_0939,0.17745803357314147,"Cloud migration: moving applications to the cloud, modernization, and optimization techniques",0.23076923076923078,0.010173543199528113,0.016536490114718083,0.011097536143351659,0.00984162895927602,0.0,0.5915492957746479,0.05490780911062909,0.39095480557894735,0.1372549019607843,0.4
EDU_0940,0.697841726618705,"Code quality and testing: unit testing, integration testing, and continuous integration",0.07692307692307693,0.0,0.0013831258644536654,0.0008144980655670943,0.0007918552036199095,0.5,0.7605633802816901,0.032944685466377466,0.32105494285060043,0.020541549953314663,0.0
EDU_0941,0.4100719424460431,Django web development: building robust web applications with Python's most popular framework,0.23076923076923078,0.023335972183415602,0.019709543568464726,0.011810221950722866,0.009728506787330317,1.0,0.5070422535211268,0.19048264642082435,0.39095480557894735,0.03081232492997199,0.0
EDU_0942,0.7937649880095923,"React development course: components, hooks, state management, and building scalable applications",0.15384615384615385,0.08785585669491788,0.12934260841265965,0.14844227244960292,0.14762443438914027,0.0,0.4225352112676056,0.4084869848156183,0.4351180182345402,0.020541549953314663,0.2
EDU_0943,0.4940047961630695,System design interview masterclass: scalability patterns and distributed systems architecture,0.07692307692307693,0.03226459905001397,0.055019933284517125,0.034514355528405614,0.03393665158371041,0.5,0.9225352112676056,0.3297180043383948,0.4021693413559717,0.20448179271708683,0.2
EDU_0944,0.580335731414868,Machine learning project tutorial: building end-to-end ML pipelines from data preprocessing to model deployment and monitoring,0.23076923076923078,0.0713490732979417,0.11111789113985843,0.12095296273671349,0.08122171945701358,0.0,0.08450704225352113,0.718004338394794,0.7098295596524693,0.1484593837535014,0.4
EDU_0945,0.6115107913669064,Native mobile development: iOS with Swift and Android with Kotlin for platform-specific apps,0.3076923076923077,0.041932880072025086,0.03230005695224148,0.017104459376908982,0.016855203619909505,0.5,0.9225352112676056,0.1868221258134491,0.3796203259682276,0.6993464052287582,0.22999999999999998
EDU_0946,0.42446043165467623,"Django deployment: configuring production environments, database optimization, and scaling applications",0.15384615384615385,0.0,0.0016272068993572533,0.0015271838729383016,0.0012443438914027148,1.0,0.11971830985915494,0.22708785249457697,0.4980928046450215,0.18487394957983194,0.3
EDU_0947,0.014388489208633093,"Algorithm optimization: time and space complexity, profiling, and performance improvement",0.15384615384615385,0.06836562044022228,0.11441298511105687,0.0986560781918143,0.0986425339366516,0.0,0.3380281690140845,0.17584056399132325,0.34487086065042316,0.380952380952381,0.3
EDU_0948,0.08872901678657073,"Backend security: authentication, authorization, data validation, and protecting against common vulnerabilities",0.07692307692307693,0.01333550650398932,0.02147913107151574,0.0123192832417023,0.010633484162895928,0.0,0.4154929577464789,0.2563720173535792,0.576629746489151,0.18207282913165265,0.2
EDU_0949,0.8225419664268585,"SQL for data analysis: complex queries, window functions, and analytical functions for business intelligence",0.4615384615384616,0.02510167334140511,0.024326743145390933,0.018224394217063736,0.015837104072398193,0.0,0.5070422535211268,0.3809652928416486,0.5478561127313686,0.0,0.3
EDU_0950,0.15347721822541965,"Tech career advancement: skill development, leadership, and navigating career growth opportunities",0.0,0.00404597808202167,0.011105687088113254,0.01170840969252698,0.010180995475113122,1.0,0.2887323943661972,0.20878524945770072,0.44587713340227975,0.48272642390289455,0.5
EDU_0951,0.539568345323741,"Object-oriented programming: classes, inheritance, polymorphism, and design patterns",0.3076923076923077,0.0039761261680792285,0.006549507769912945,0.006210547749949094,0.005542986425339367,0.5,0.5211267605633803,0.2931127982646422,0.28429644614156135,0.12605042016806725,0.6
EDU_0952,0.8081534772182254,React Native mobile development: cross-platform app development with React Native and Expo,0.15384615384615385,0.030738722796560182,0.047595801806199656,0.0423538994094889,0.041176470588235294,0.0,0.3380281690140845,0.3150759219088938,0.3565810763904089,0.18487394957983194,0.2
EDU_0953,0.2661870503597122,Comprehensive data science tutorial: from data collection and preprocessing to advanced analytics and visualization using Python libraries,0.4615384615384616,0.04932321256713545,0.048653486290781874,0.04113215231113826,0.037556561085972856,0.0,0.4225352112676056,0.6941431670281998,0.8055122860893507,0.2978524743230626,0.7
EDU_0954,0.6258992805755396,"Mobile app development: React Native, Flutter, and cross-platform development strategies",0.15384615384615385,0.01039551705938965,0.019526482792287036,0.019853390348197924,0.01843891402714932,1.0,0.8450704225352113,0.30775488069414325,0.333029801803721,0.46218487394957986,0.4
EDU_0955,0.11510791366906474,"Backend security: authentication, authorization, data validation, and protecting against common vulnerabilities",0.15384615384615385,0.008112911738226071,0.010129362948498902,0.00600692323355732,0.0046380090497737565,0.5,0.28169014084507044,0.2563720173535792,0.576629746489151,0.7852474323062557,0.4
EDU_0956,0.7482014388489208,"Programming best practices: clean code, version control, and collaborative development",0.0,0.06444071900903418,0.11502318769831583,0.13775198533903482,0.13778280542986426,0.0,0.5915492957746479,0.36822125813449025,0.30894322540416486,0.9570494864612512,0.43
EDU_0957,0.882494004796163,"Software engineering career: roles, responsibilities, and advancing in the tech industry",0.07692307692307693,0.0013504703362205456,0.008156374583028233,0.009366727754021583,0.009389140271493214,0.0,0.4225352112676056,0.30775488069414325,0.333029801803721,0.7637721755368814,0.43
EDU_0958,0.697841726618705,"Software project management: agile methodologies, team collaboration, and delivery strategies",0.07692307692307693,0.006771754990531185,0.011878610365307948,0.007839543881083282,0.005995475113122172,0.0,0.7042253521126761,0.3260574837310196,0.39095480557894735,0.020541549953314663,0.0
EDU_0959,0.15107913669064746,"Tech career advancement: skill development, leadership, and navigating career growth opportunities",0.4615384615384616,0.013427090124491635,0.02040110650069156,0.01547546324577479,0.013461538461538462,0.5,0.7112676056338029,0.20878524945770072,0.44587713340227975,0.1372549019607843,0.2
EDU_0960,0.6810551558752997,Full-stack JavaScript development: using Node.js with React for complete web applications,0.07692307692307693,0.04502499146254385,0.03638841428687658,0.02728568519649766,0.017873303167420817,1.0,0.0,0.17584056399132325,0.34487086065042316,0.24369747899159666,0.6
EDU_0961,0.580335731414868,"Machine learning for beginners: understanding algorithms, choosing the right model, and avoiding common pitfalls",0.38461538461538464,0.002121169786718823,0.0075868521682531925,0.006210547749949094,0.005429864253393666,0.5,0.9366197183098591,0.32781995661605223,0.5860499306619928,0.1484593837535014,0.4
EDU_0962,0.580335731414868,Machine learning project tutorial: building end-to-end ML pipelines from data preprocessing to model deployment and monitoring,0.15384615384615385,0.0753104529508553,0.10554470750955984,0.057727550397067805,0.057805429864253396,1.0,0.647887323943662,0.718004338394794,0.7098295596524693,0.1484593837535014,0.4
EDU_0963,0.4844124700239808,"Building interactive user interfaces: state management, component design, and user experience best practices",0.15384615384615385,0.002301232498214896,0.00351883491986006,0.00285074322948483,0.0027149321266968325,0.5,0.9225352112676056,0.3131778741865511,0.5478561127313686,0.5032679738562092,0.2
EDU_0964,0.697841726618705,Competitive programming: problem-solving strategies and advanced algorithmic techniques,0.15384615384615385,0.02397472912980038,0.02011634529330404,0.006515984524536754,0.005429864253393666,0.5,0.5915492957746479,0.30409436008676793,0.32105494285060043,0.020541549953314663,0.0
EDU_0965,0.7338129496402878,"Programming best practices: clean code, version control, and collaborative development",0.3076923076923077,0.008688801962062648,0.008481815962899682,0.004683363877010792,0.004185520361990951,1.0,0.5070422535211268,0.36822125813449025,0.30894322540416486,0.23809523809523808,0.22999999999999998
EDU_0966,0.9952038369304556,Web development project tutorial: building a complete e-commerce website from scratch,0.23076923076923078,0.01658051597280432,0.022475795297372057,0.014457340663815923,0.010407239819004526,1.0,0.5070422535211268,0.6831616052060738,0.29669148500165754,0.44164332399626527,0.2
EDU_0967,0.26139088729016785,"Data science career guide: essential skills, tools, and projects for becoming a successful data scientist in 2024",0.0,0.05172922293626401,0.07515661866406313,0.06953777234779067,0.06957013574660634,0.5,0.14788732394366197,0.7382049891540132,0.5953871165388671,0.38001867413632123,0.6
EDU_0968,0.5059952038369304,System design interview masterclass: scalability patterns and distributed systems architecture,0.15384615384615385,0.013767812238055323,0.025770889268570497,0.028303807778456525,0.028393665158371044,0.0,0.676056338028169,0.3297180043383948,0.4021693413559717,0.7637721755368814,0.2
EDU_0969,0.8968824940047961,"Object-oriented programming: classes, inheritance, polymorphism, and design patterns",0.07692307692307693,0.030276147899785784,0.030042307379383286,0.017104459376908982,0.012782805429864255,0.5,0.7816901408450705,0.2931127982646422,0.28429644614156135,0.07189542483660132,0.3
EDU_0970,0.44604316546762585,Flask vs Django: choosing the right Python web framework for your project needs,0.0,0.005619198410480892,0.007464811650801399,0.007228670331907962,0.0057692307692307696,1.0,0.7183098591549296,0.13923535791757052,0.22004867009874207,0.20448179271708683,0.4
EDU_0971,0.7625899280575539,"Python automation and scripting: automating tasks, file processing, and API integrations",0.15384615384615385,0.018783955791499798,0.039622487999349115,0.029220118102219507,0.02929864253393665,0.0,0.8098591549295775,0.03660520607375273,0.333029801803721,0.03081232492997199,0.3
EDU_0972,0.856115107913669,"Database fundamentals: normalization, indexing, transactions, and performance tuning strategies",0.38461538461538464,0.034925956971221014,0.0393377267919616,0.024231317450621057,0.019570135746606335,0.5,0.34507042253521125,0.19780368763557488,0.4132664452816375,0.18487394957983194,0.3
EDU_0973,0.15107913669064746,"Career transition to tech: portfolio building, networking, and landing your first developer job",0.07692307692307693,0.0,0.0029086323326010903,0.00285074322948483,0.00248868778280543,1.0,0.2535211267605634,0.06222885032537967,0.4132664452816375,0.1372549019607843,0.2
EDU_0974,0.028776978417266185,"Algorithm design techniques: divide and conquer, dynamic programming, and greedy algorithms",0.07692307692307693,0.04343547235416473,0.04371084533398421,0.0285074322948483,0.025,0.5,0.08450704225352113,0.5898861171366595,0.3681633090686507,0.5032679738562092,0.2
EDU_0975,0.961630695443645,"Modern web development practices: responsive design, performance optimization, and deployment strategies",0.07692307692307693,0.0004253205426717581,0.00380359612724758,0.002443494196701283,0.0018099547511312218,0.5,0.3380281690140845,0.4341106290672453,0.5082341618579367,0.1372549019607843,0.2
EDU_0976,0.3069544364508393,Database backup and recovery: disaster recovery planning and data protection strategies,0.3076923076923077,0.061243829747601744,0.06622732080384021,0.044288332315210746,0.03936651583710407,0.0,0.8028169014084507,0.30409436008676793,0.32105494285060043,0.18207282913165265,0.3
EDU_0977,0.8848920863309352,"Software architecture patterns: MVC, microservices, and designing maintainable systems",0.07692307692307693,0.009127316755145758,0.012814254332438369,0.009875789045001018,0.008031674208144797,0.5,0.7042253521126761,0.4360086767895879,0.30894322540416486,0.8067226890756302,0.22999999999999998
EDU_0978,0.7338129496402878,"Object-oriented programming: classes, inheritance, polymorphism, and design patterns",0.07692307692307693,0.008593337679674646,0.012122691400211537,0.0076359193646915085,0.006447963800904978,0.0,0.676056338028169,0.2931127982646422,0.28429644614156135,0.23809523809523808,0.22999999999999998
EDU_0979,0.4964028776978417,System design interview masterclass: scalability patterns and distributed systems architecture,0.15384615384615385,0.04494116916581292,0.07688552599463022,0.07920993687639992,0.0746606334841629,0.0,0.5915492957746479,0.3297180043383948,0.4021693413559717,0.9355742296918766,0.6
EDU_0980,0.12949640287769784,"Algorithm and data structures: arrays, linked lists, trees, graphs, and sorting algorithms",0.15384615384615385,0.022947129862469343,0.02782523797900903,0.021686010995723887,0.017760180995475116,0.0,0.49295774647887325,0.45065075921908904,0.3565810763904089,0.24369747899159666,0.3
EDU_0981,0.3285371702637889,"Database security: access control, encryption, and protecting sensitive information",0.15384615384615385,0.0,0.002928972418843056,0.0030543677458766036,0.0029411764705882353,0.5,0.4225352112676056,0.15387744034707163,0.2717547170270258,0.849673202614379,0.5
EDU_0982,0.961630695443645,Frontend and backend development: creating dynamic web applications with modern frameworks and tools,0.07692307692307693,0.034925956971221014,0.03002196729314132,0.025147627774384035,0.020927601809954753,0.5,0.09859154929577466,0.21610629067245124,0.46707311478370617,0.1372549019607843,0.2
EDU_0983,0.21103117505995203,"Algorithm and data structures: arrays, linked lists, trees, graphs, and sorting algorithms",0.23076923076923078,0.04627223619260501,0.05074851517370434,0.026369374872734677,0.01979638009049774,0.0,0.676056338028169,0.45065075921908904,0.3565810763904089,0.1372549019607843,0.03
EDU_0984,0.6642685851318945,"MongoDB Atlas: cloud database management, scaling, and production deployment strategies",0.15384615384615385,0.021959113346372357,0.020482466845659422,0.011810221950722866,0.008031674208144797,1.0,0.9225352112676056,0.16851952277657267,0.32105494285060043,0.4005602240896359,0.2
EDU_0985,0.05275779376498801,"Data analytics career guide: tools, skills, and projects for becoming a successful data analyst",0.15384615384615385,0.06127254664555587,0.09982914327556748,0.08990022398696802,0.08495475113122172,0.0,0.16901408450704225,0.6723156182212583,0.4132664452816375,0.22408963585434177,0.6
EDU_0986,0.4940047961630695,"Technical interview preparation: algorithms, data structures, and system design concepts",0.15384615384615385,0.013326969047840802,0.0243470832316329,0.02412950519242517,0.02420814479638009,0.0,0.676056338028169,0.4433297180043385,0.333029801803721,0.20448179271708683,0.2
EDU_0987,0.8585131894484412,"SQL mastery course: database design, query optimization, and advanced SQL techniques",0.15384615384615385,0.11253919468504547,0.15838825156618663,0.156485440847078,0.14683257918552037,0.0,0.0,0.496475054229935,0.28429644614156135,0.24369747899159666,0.3
EDU_0988,0.3405275779376499,Machine learning project tutorial: building end-to-end ML pipelines from data preprocessing to model deployment and monitoring,0.15384615384615385,0.04233724504051411,0.022170694003742573,0.014457340663815923,0.00916289592760181,1.0,0.8169014084507042,0.718004338394794,0.7098295596524693,0.11484593837535015,0.4
EDU_0989,0.697841726618705,"Algorithm design techniques: divide and conquer, dynamic programming, and greedy algorithms",0.15384615384615385,0.0328862810841017,0.018346757790253028,0.008043168397475054,0.005316742081447964,1.0,0.971830985915493,0.5898861171366595,0.3681633090686507,0.020541549953314663,0.0
EDU_0990,0.21103117505995203,"Algorithm and data structures: arrays, linked lists, trees, graphs, and sorting algorithms",0.4615384615384616,0.0023283971314147344,0.0020746887966804975,0.000916310323762981,0.00045248868778280545,0.0,0.5915492957746479,0.45065075921908904,0.3565810763904089,0.1372549019607843,0.03
EDU_0991,0.697841726618705,"Advanced algorithms: graph algorithms, string matching, and computational complexity analysis",0.15384615384615385,0.027243798702306664,0.0351883491986006,0.025147627774384035,0.0248868778280543,0.0,0.5,0.4616323210412149,0.39095480557894735,0.020541549953314663,0.0
EDU_0992,0.2589928057553957,"Data science career guide: essential skills, tools, and projects for becoming a successful data scientist in 2024",0.3076923076923077,0.008449753189904069,0.013302416402245545,0.0123192832417023,0.010633484162895928,0.0,0.5140845070422535,0.7382049891540132,0.5953871165388671,0.38001867413632123,0.4
EDU_0993,0.3405275779376499,Machine learning project tutorial: building end-to-end ML pipelines from data preprocessing to model deployment and monitoring,0.07692307692307693,0.00013582316599919288,0.0028069319013912615,0.0021380574221136228,0.0014705882352941176,0.5,0.5774647887323944,0.718004338394794,0.7098295596524693,0.11484593837535015,0.4
EDU_0994,0.05995203836930455,"Artificial intelligence fundamentals: understanding AI concepts, applications, and future implications in various industries",0.15384615384615385,0.0023136506162491077,0.004698559921894069,0.003257992262268377,0.002601809954751131,0.0,0.676056338028169,0.16838394793926253,0.6930075597605656,0.22689075630252103,0.4
EDU_0995,0.697841726618705,"Software development lifecycle: planning, coding, testing, and maintaining quality code",0.07692307692307693,0.034925956971221014,0.04763648197868359,0.040826715536550595,0.03676470588235294,0.0,0.9577464788732395,0.4396691973969632,0.32105494285060043,0.020541549953314663,0.0
EDU_0996,0.8273381294964028,SQL project tutorial: designing and implementing a complete database system from scratch,0.4615384615384616,0.008384558070224458,0.010271743552192661,0.008755854204846262,0.007352941176470589,0.0,0.2535211267605634,0.8297180043383949,0.333029801803721,0.22408963585434177,0.6
EDU_0997,0.05275779376498801,"Business analytics with Python: data visualization, statistical analysis, and creating actionable insights from data",0.23076923076923078,0.01517494023780696,0.02054348710438532,0.020158827122785584,0.020135746606334843,0.0,0.676056338028169,0.5458242950108461,0.6229149951967026,0.22408963585434177,0.6
EDU_0998,0.3741007194244604,"DevOps monitoring: logging, metrics, alerting, and maintaining system reliability",0.07692307692307693,0.0,0.003600195264827923,0.0025453064548971696,0.002149321266968326,0.0,0.33098591549295775,0.01098156182212584,0.24621700560476611,0.3025210084033614,0.4
EDU_0999,0.3405275779376499,Deep dive into machine learning algorithms: supervised and unsupervised learning techniques with practical Python implementations,0.0,0.07917559218900376,0.09301521438450899,0.047037263286499695,0.040271493212669686,0.5,0.0,0.45783622559652937,0.7345722494759324,0.11484593837535015,0.4
